ee09b8cb72d38f8a607eda9b4c2fec4b, 5年产品3年创业，电商旅游O2O背景，具备搜索、即时配送经验 -                                    ,男,31岁,本科, 饿了么-                            -                                                                            ,-                                资深产品 ,8年工作经验,上海,,产品总监高级产品经理,全职,杭州,25k,50k,-------,自我评价和优势,- -具有敏锐的互联网产品嗅觉，对数据敏感，对新事物新产品接受适应能力强，有丰富的互联网产品及营销管理知识储备。能总结产品事物的核心价值并提出合理且有创新的想法，成熟稳重，优秀的沟通能力和技巧，应变和抗压能力强，具备高度责任感。--,{ 工作经历 :阿里巴巴,2009.04 , 2011.03,搜索产品经理,-负责搜索产品线业务，包括从底层产品架构设计，后台产品管理发布-前台搜索筛选机制和搜索规则，产品展现和供应商店铺管理--GearBox搜索大型项目负责人之一，项目历时一年，涉及销售、产品设计、运营、SEO、UED、技术等多部门协作，开发设计出“UsedCar”、”PersonalCare”等专业化的搜索页面，提升了用户的搜索体验以及搜索转化率-GetLatestPrice项目发起实施人，该项目以最小的业务资源成本，创造了极大的运营成果，通过不断的迭代设计开发，反向推动了从用户注册到发送反馈的流程优化，反馈数增加40%，转化率较项目发布前提升130%-产品Detail/供应商Minisite管理负责人。通过收集用户反馈、数据测试分析，优化产品页面、改进用户流程，提升页面的转化率---;罗恩贸易有限公司,2011.03 , 2014.04,合伙人,-电商平台业务规划,活动营销策划,新品开发，团队管理--带领团队，销售额从2011年的90万增长至2013年的400万-带领运营团队运作公司淘宝平台，从0信用升至皇冠仅用96天-负责新产品的探索与开发，通过竞争对手、综合自身优势资源，将SKU从200开发至2500的规模，类目主要涉及家纺、女装、母婴玩具玩偶-开拓电商运营多个平台渠道(Taobao,Aliexpress,1688,DHgate,Ebay),并负责搭建公司独立站点，从建立底层数据和类目体系，搜索呈现，打通支付功能，完善优化预定流程。-多次策划并成功运营电商平台大型活动，负责方案设计、人员安排、日程规划、采购储备、物流、风险防范---;携程,2014.05 , 2015.08,高级技术产品经理,-负责频道首页和搜索产品线(无线和PC端)，个性化推荐项目负责人	•	无线和PC端搜索产品线相关功能设计、架构规划和运营     重要项目: 全球POI搜索、个性化筛选、主题搜索     通过快速迭代和Scrum项目模式，与技术团队协作，提升搜索二跳率超过10%	•	负责旅游各首页频道改版，通过A-B test方式，将频道首页跳出率降低40%；并改造前后台将无线数据统一，高效降低了运营维护成本；负责旅游频道频道首页、搜索的5.6-6.9十个无线版本的产品设计和功能改进	•	个性化推荐项目负责人个性化推荐项目发起人，带领数据团队、运营团队、搜索团队，从算法研究、测试，到底层基础数据运营，再到搜索逻辑支持，协调营销和各部门，开发应用场景，将旅游产品的千篇一律时代带领进入千人千面时代--;饿了么,2015.08 , 至今,资深产品,-饿了么蜂鸟物流  即时配送BU资深产品经理-历任组织运力、离线数据、成本中心产品线负责人,带领团队将代理模式配送规模增长了近20倍，参与和主导了代理商配送模式的主产品架构搭建。- 重要项目:--蜂鸟专送--通过从用户端APP、商家端、配送端的服务标准建设，将物流系统由单一信息流模式，进化为具备C端收费、商户收费、代理商分润、逐单差异化服务的新配送模式，带领团队主导了包括代理商基建、智能分流调度、骑手APP等子项目，专送项目将原来的日均配送时长缩短了40%。--自营转代理--带领团队完成物流自营站点转换代理项目，包括人员系统对接、配送系统切换、会员系统、薪酬账单等系列子项目，协调业务、运营、技术通过灰度平稳将全国自营站点切换成代理模式，保障了各项业务指标数据的稳定和自营保留的六大城市效率化运营。--离线业务:费用中心、反欺诈规则引擎、成本中心--费用中心产品的0到1搭建，包括费用项编码规范、费用接入标准、财务/业务体系费用项对接、费用风控。-反欺诈规则引擎，从人工创建规则堆叠，到系统半自动生成规则集组建模型，提升50%反欺诈运营效率，反欺诈准确率提升约20%。-成本中心，实现独立费用成本模块，差异化定价，个性化补贴。---;},{南京航空航天大学,本科 , 信息安全,2009年毕业;},{},{},{}
3fd73908adc1fed009ecc934b68f4cfd, 工作中我是一个吃苦耐劳，珍惜时间，不断进取和善于学习的人。 -                                    ,女,26岁,本科, 江苏润和软件股份有限公司-                                -                                                                                                            ,-                                    软件测试工程师 ,2年工作经验,南京,-1、良好的团队合作精神，能迅速融入新的团队-2、能吃苦耐劳，能在较大的压力下保持良好的工作状态，善于自我调节-3、有较强的学习及适应能力-4、具有强烈的责任感，工作踏实。性格乐观开朗，积极向上-5、善于学习能不断提高自身的能力与综合素质-6、具有较强的文档撰写能力--,软件测试工程师,全职,南京,5k,10k,,,,{ 工作经历 :南京亚信软件有限公司,2014.07 , 2015.10,java软件工程师,;江苏润和软件股份有限公司,2015.11 , 至今,软件测试工程师,;},{南京航空航天大学,本科 , 软件工程,2014年毕业;},{河南移动CRM架构演进产品中心,终端销售品模型的维护；为前台受理提供相应的接口及测试数据配置,2014.07 , 2015.10,-该系统主要是为河南移动营业员提供操作，以电商的模式改造购机助手（移动终端）。按照不同的终端可以参与的营销活动及合约期和档次从而完成一个订购操作。使得营业员操作更加简单便捷。--;瑞中数据海迅交换平台,用户操作手册及说明文档的撰写；软件新版本发布；解决现场问题,2015.11 , 2016.09,-该系统主要是解决系统间企业信息不一致的问题。主要提供数据交换、数据处理，文件传输等功能。--;智能能效管理系统,编写并执行测试用例；对测试结果进行分析并提交bug缺陷报告,2016.10 , 至今,-该系统主要是对办公建筑的各个用能单位的各类能源进行管理和监控，实现对用能单位的用能进行监管，避免恶性负载、漏电、超负荷用电等现象的发生，确保安全用能。--;},{},{}
f8dcfac43a2c1464613af4a96ba620ba, 熟悉电商模式，有产品思维，注重方法论 -                                    ,女,25岁,本科, 安居客-                            -                                                                            ,-                                高级运营专员（产品运营） ,2年工作经验,上海,--虽然是房地产出身，但我拥有一颗轻盈活泼的内心，请Hr不要看见“房”就把我打入冷宫~-1.热爱用户，有责任心，执行力突出，对电商模式的用户生命周期有研究；-2.产品思维，注重方法论，熟悉Axure，Visio，xmind软件；-3.熟练掌握，微信图文，H5制作，石墨，金数据，Excel(函数)，Word；-4.数据分析，熟悉友盟,TalkingData百度统计后台。---,产品运营,全职,上海,10k,15k,----希望找到一家年轻有活力的公司，有牛人带队最好---,,,{ 工作经历 :南京中信银行,2014.07 , 2014.09,实习生,;上海房多多网络科技有限公司,2015.01 , 至今,用户运营及活动策划,-新媒体运营-微信图文，H5制作用户运营：什么周期研究应用+核心用户维护产品运营：对接产品技术，提需求，项目跟进。--;安居客,2016.08 , 至今,高级运营专员（产品运营）,-1.对接B端供应商2.CRM与CMS后台的维护-业务上线安排 3.新业务CMS后台的搭建-产品原型设计等--;},{南京航空航天大学,本科 , 日语,2015年毕业;},{APP活跃计划,策划 执行 数据分析和活动调整,2015.11 , 2016.03,-项目背景：APP用户转化不理想-项目目的：活跃用户，增强粘性-项目执行：策划了“举报房源”“首约有奖”等系列活动。策划有运营经理指导，后期的H5制作和数据跟踪和分析，独立完成。--;购房速成班,活动负责人、策划、统筹、执行,2015.11 , 2016.05,-吸引用户来房多多线下交易中心，听课。-前期准备工作：h5内容宣传、学员招募，活动的物料准备。课程内容包括：房多多模式、买房注意事项、贷款按揭政策和疑问解答、抽奖互动环节。后期工作：用户问卷调查、课程视频的宣传。--;微信群运营,群主 招募用户并管理运营,2015.08 , 2016.11,-项目背景：每个公司都该有其核心用户，传播口碑和必要的产品的灰度测试 项目目的：初步粘住用户，进一步服务用户 项目执行：我负责各端资源调配，招募用户，辨别身份拆分群组。身兼群主和管理员以及客服多种角色。解决用户需求，挖掘潜在用户，并反馈产品经理，优化产品。--;流失老用户的召回,定义流失用户，分析流失原因，推送所需内容召回,2015.11 , 至今,-项目背景：老用户流失项目目的：老用户召回项目执行：定义流失用户，拉取这批用户的浏览记录，匹配可能感兴趣的内容，制作内容，分ABtest推送，跟踪数据转化。成果：老用户召回相比未做动作提升60%--;资源位管理,对各端的需求方进行排期协调，并安排banner和push资源,2016.02 , 至今,-资源位（banner push 设计）的总负责，排期+协调+配置上线+数据反馈（流量入口ctr）--;APP下载引导,将内部PC和M站流量导入APP，策划方案并执行,2016.05 , 至今,-项目背景：APP转化效果优于其他两端，但直接投放成本较高。项目目的：将PCM的用户引导下载APP我负责在各端铺设入口，用符合场景的文案引导下载，在0活动费用的情况下，原每周下载91（项目前一周），提升至758个（目前）--;},{Xmind,掌握;SQL,熟悉;H5+微信图文,精通;Axure,掌握;Visio,掌握;},{}
df7e4aa2698c249f04d6434222394f0b, 跳进前端的坑，在里面晒太阳 -                                    ,男,27岁,本科,,,3年工作经验,杭州,,,,,,,,,,{:},{},{},{},{}
2c2e828ed44a61e28f361cda176c2662, 游戏特效基本功扎实，有自己的想法和创意；有责任心学习能力强 -                                    ,男,24岁,本科, 光影工作室-                            -                                                                            ,-                                游戏特效师 ,2年工作经验,北京,-接触游戏特效基础软件较长时间了，功底扎实，无论是三渲二，u3d还是ue4都得心应手，有自己的创新的想法；为人和善，善于沟通，能够很快的融入团队，学习能力强，有责任心。--,游戏特效师,全职,北京,5k,10k,,,,{ 工作经历 :无锡誉璟环境工程有限公司,2015.07 , 2015.12,cad制图员或设计师助理,-1.国外空调系统报价翻译及产品介绍ppt的制作；-2.根据客户的需求完成空调系统的CAD图纸绘制。--;光影工作室,2016.02 , 2016.10,游戏特效师,-手游项目中的ui，场景以及角色技能的特效制作--;},{南京航空航天大学,本科 , 民航机务工程,2015年毕业;},{光影三国,游戏特效师,2016.02 , 2016.10,-三国题材的卡牌手游--;},{UE4,精通;AE,精通;3dmax,精通;U3D,精通;PS,精通;},{}
8396431e6602bd9521985b8b8197d174, 十分渴望和一个阳光积极、充满激情和活力的团队一起努力奋斗。 -                                    ,,,硕士, 艾欧史密斯中国热水器有限公司-                                -                                                                                                            ,-                                    项目经理 ,2年工作经验,南京,,,,,,,,,,{:},{},{},{},{}
1e4177befb73de6b01b97bcc72d0d257, 与同事相处融洽 较好团队合作能力 工作有条不紊 高效率 -                                    ,女,,硕士, 浙江娱佳网络科技有限公司-                                -                                                                                                            ,-                                    前端工程师 ,2年工作经验,杭州,,,,,,,,,,{:},{},{},{},{}
7ca35d6d888652adfec4dfd8a4e3db4e, 5年开发经验，学习能力强 -                                    ,女,,硕士, 爱奇艺-                                -                                                                                                            ,-                                    软件工程师 ,5年工作经验,上海,-乐于团队合作，注重沟通交流，喜欢研究数据，分析数据，做事认真负责，对工作有极大的热情--,大数据开发工程师,全职,上海,15k,25k,-------,,,{ 工作经历 :欧科佳（上海）汽车电子有限公司,2011.07 , 2012.10,软件工程师,-开发基于Windows平台环境，采用WinFormC/S架构的应用软件。该软件由三部分组成：上层、中间层和底层。上层采用C#开发语言，中间层采用webservic开发，底层使用C++开发，基于Pssthru通讯协议，本人主要负责上层和中间层软件开发。该软件系统具有手动识别，自动识别，诊断，快速通道，数据管理和其他特殊功能。--;爱奇艺,2013.07 , 至今,软件工程师,-负责爱奇艺播放器客户端的部分网络编程，实时日志计算平台的统计工作，脚本自动化报表生成 --;},{南京航空航天大学,本科 , 计算机科学与技术,2009年毕业;成都理工大学,硕士 , 计算机应用技术,2013年毕业;},{预推送下载模块,完成该模块的获取列表成功下载成功投递任务统计，完成流量平滑,2014.01 , 2014.02,-预先推送热门视频下载--;HCDN的静默自升级功能,完成静默升级,2014.07 , 2014.09,-CDNClientNetUpdate模块是HCDNClientNet.dll中的一个模块，用于实现HCDNClient的一个静默升级，只更新组件HCDNClientNet.dll。可以实现针对指定区间的版本（目前是支持2个闭区间版本：在配置文件中指定）升级以及按照一定比例（在配置文件中指定）做升级。 --;NetDoctor项目,编写优化NetDoctor的CDN下载逻辑功能，测速功能,2015.01 , 2015.05,-具有CDN测速、相关探测、HTTPDNS查询和其他检测等功能的调用接口。目前，CDN测速功能同时适用于点播和直播，且支持F4V和TS两种文件类型；相关探测功能主要包括域名探测、接口探测和下载探测，后续可扩展；HTTPDNS查询功能支持所有公司域名的查询；其他检测功能主要是网络连通性检测，后续可扩展. --;storage模块的重构工作,完成重构后的块信息，块数据和块管理的类实现。完成保存数据流程,2015.05 , 2015.09,-重构储存模块，采用新缓存文件格式存储--;实时日志计算平台业务,读取日志数据进行统计分析,2015.09 , 2016.03,-HCDN的日志数据存放在Kafka平台上，首先需要从Kafka获取数据流，使用spark streaming连接上kafka数据流，从中读取日志数据进行统计和分析工作。主要工作在于编写python统计数据脚本。 -一、统计每五分钟各种类型日志的次数，统计每五分钟交叉投递的上传流量，统计每五分钟错误码的IP次数，按照版本号分类显示p2p和http的下载流量，统计移动端连接wifi状态的情况，抓取web页面数据进行二次计算，生成excel图表等统计工作。-二、每天日报数据统计-三、每周的周报数据统计--;自动化报表生成,抓取网络数据，生成报表,2017.01 , 至今,-使用urllib2进行抓包，针对于网络抓取的数据，生成txt文件，然后使用python对txt文件进行解析使用xlsxwriter生成excel图表。提取两周数据生成所有平台所有版本的分享比晚峰值，下载流量晚峰值的折线图。完成所有平台所有版本的晚高峰分享比峰值图。 --;},{了解Kafka/ZooKeeper/Hadoop/HBase,了解;熟悉Spark，Streaming编程,熟悉;C++,Python，Socket，HTTP， Spark,掌握;},{}
5554b91c2677d60e98045fab22c8a29a, 嵌入式，地面机器人 -                                    ,男,,硕士,,,2年工作经验,北京,,嵌入式开发类,全职,北京,15k,25k,,,,{ 工作经历 :通用电气,2014.04 , 2014.07,系统工程师,-实习。Linux下C++和Qt开发，编写测试软件和脚本--;某研究所,2015.07 , 至今,嵌入式/系统工程师,-嵌入式软件，硬件单机，系统设计。-负责完成两个应用软件,一个控制类硬件单机（带显示屏）,特种车CAN总线控制系统。--;},{南京航空航天大学,本科 , 交通运输（民航机电工程）,2012年毕业;北京航空航天大学,硕士 , 机械电子,2015年毕业;},{伽玛相机载运机器人,硬件和嵌入式软件,2014.04 , 2014.12,-原子能科学院横向项目--;基于可再生能源的超长续航冰盖漫游机器人样机,技术负责人,2012.09 , 2015.06,-863重点项目--;},{Keil,精通;AltiumDesigner,掌握;C++,掌握;C语言,精通;},{}
388be2e4658e760f7ae9a57beba8817b, 一切以结果为导向 -                                    ,男,34岁,大专, 中汇电子支付有限公司-                            -                                                                            ,-                                苏州公司总经理 ,10年以上工作经验,苏州,,,,,,,,,,{:},{},{},{},{}
86db7ba53e24df966b69eb31b6150735, 执行力 -                                    ,女,,本科,,,应届毕业生,南京,,运营,全职,上海,5k,10k,-------,,,{ 实习经历  :工商银行,2017.02 , 2017.03,实习生,-企业贷款--;南京智鹤电子科技有限公司,2017.02 , 2017.05,新媒体运营,--1.负责新媒体平台微博、微信、头条等内容建设，包括内容策划、选题、执行，跟踪推广效果，整理分析数据并反馈；-2.把握公司新媒体运营的整体风格和个性，开展阶段性的线上活动，跟踪推广效果；-3.及时掌握行业资讯和新闻热点，结合新媒体特性，不断研究运营手段与推广模式；-4.参与公司整体品牌、产品的营销策划与市场推广，尤其是微信微博等社会化媒体开展品牌营销工作；-5.增加微信微博粉丝数量，提高粉丝活跃度与参与度。---;南京智鹤电子科技有限公司,2017.03 , 2017.05,市场专员,-策划品牌营销案件，促进销售-软文，文案的编辑与策划-负责相关公关工作，保持公司形象--;玻儿彩妆,2016.07 , 2017.09,总助,-相关稿件的撰写-市场调查-日常工作的指令传达---;},{南航,本科 , 电子商务,2017年毕业;},{},{},{}
f19c370ed1b340bb2d1aafe193f7cf76, 不想赚大钱的伪极客不是好文青。 -                                    ,男,29岁,本科, 无锡智学苑-                            -                                                                            ,-                                前端工程师 ,6年工作经验,无锡,,,,,,,,,,{:},{},{},{},{}
9d3980c017ac8325f5b6ddd9adbb9495, 不要让用户自己去思考 -                                    ,女,25岁,本科, 中纪海富网络科技有限公司-                                -                                                                                                            ,-                                    交互设计师 ,3年工作经验,南京,-完美主义者、逻辑严谨、思维灵活有创意，喜欢尝试新行业，挑战全新的产品。-10年前开始自学PS，然后大学自学AI、AE，工作以后自学AXURE和墨刀，喜欢制作作品来表达自己的想法。-一直在不断学习，业余时间看过《About Face3 交互设计精髓》、《设计心理学》、《点石成金》、《用户故事地图》等很多设计相关书籍。-手机中有上百个APP，每天坚持在“Dribbble”、“Behance”“Awwwards”上学习世界各地的好设计。-大二开始接触网站设计，大大小小已完成二十几个项目。熟悉web、iso、Android产品的设计规范和理念，项目涉及工具类、社交类，覆盖医疗设备、空气检测、智能家居、物业管理、安防报警、oa系统、B2B、O2O、P2P等行业。-感悟：-1.不要把难题丢给用户，考虑全面各种场景下可能出现的问题，不要让用户思考、困惑、犹豫不决。-2.尽可能做最符合产品特性的设计，而不是做能套用到所有产品上的设计。-3.提高信息转化率，降低视觉噪点，尽可能把信息做到可视化，拒绝晦涩难懂。-4.在创新和易用性上取得平衡，让小白用户可以使用基本功能，让专家型用户可以有探索的空间。--,交互设计师,全职,南京,10k,15k,-------,,,{ 工作经历 :南京spark界面设计公司,2014.10 , 2015.02,交互设计/视觉设计,-参与了多项移动端和pc端的产品设计，对于ios、Android、web的使用场景用户习惯等设计特性都有了了解，培养了严格的设计规范。--;安澳智能系统（南京）股份有限公司,2015.03 , 2016.09,交互设计,-根据需求和用户研究的结果，完成界面的信息架构、流程设计和原型设计，提高产品的易用性； 对现有产品的可用性测试和评估，提出改进方案，持续优化产品的用户体验； 编写界面交互设计文档，维护和更新界面设计标准和规范； 与开发和UI人员对接和协调开展工作。--;毗邻医疗,2016.10 , 2016.12,产品经理（UE方向）,-该公司致力于做大数据+人工智能的智慧医疗。我负责重构产品的功能框架，将功能模块整合成为可为用户所用的服务，以及优化原有产品范围层、结构层、框架层、表现层的用户体验。--;中纪海富网络科技有限公司,2017.02 , 至今,交互设计师,-负责产品原型设计，用户体验方面工作--;},{南京航空航天大学附属高级中学,其他 , 理科,2011年毕业;南京信息工程大学滨江学院,本科 , 测控技术与仪器,2015年毕业;},{蜘蛛笔记,ui/ue设计师,2016.04 , 至今,-作为一个工具类应用，对于工作效率要求很高，要解决功能的创新与产品的易用性之间的茅盾。无论是对于信息架构还是流程设计都是一个比较大的挑战，要考虑如何在移动端展现xmind的结构，还要解决跨层级移动手势的选择的问题。-经历了三个版本的原型设计，我们解决了以下几个难题：-01.在首页放添加按钮，并且增加动效设计，用户在各种场景下快速创建碎片。-02.在碎片盒icon上增加小红点让用户习惯整理自己的碎片盒，同时可以知道未整理碎片数量。-03.增加了面包屑导航让用户在复杂的层级中不迷失。-04.增加了大纲页让用户在任意层级中快速跳转。-05.使用拖拽的手势让用户在按照逻辑排序的列表页中可以一次性完成选择位置以及新建节点两个操作。-06.通过大纲页处理跨层级移动。-07.对于按逻辑排序和时间排序不同的页面单体操作和批量操作的交互形式不同。08.搜索页面作为一个特殊页面在返回机制中单独呈现。-09.“长文”和“节点”在搜索结果中用两种不同的形式各有侧重的展现。-10.长文中“文字”直接点击触发编辑态，“图片”需要点击编辑按钮来触发，“录音”只有标签有编辑态。-11.“录音”碎片中通过添加动效来让用户知道添加的时间。-12.播放录音时，标签采用类似于歌词播放的形式来同步显示--;},{AXURE,熟悉;墨刀,精通;AE,熟悉;AI,掌握;PS,精通;},{,;,;http://t.cn/Rxs5zyV,健康慧设计原型;http://t.cn/RcTLqb0,;http://t.cn/RcCBJch,;http://t.cn/RcCuYto,;}
