1fad482af5dccddfcbe0733fa6d33e07, 主要负责web项目后端开发，以及负责一些前端页面逻辑的编写； -                                    ,男,,本科, 上海际扬通讯科技有限公司-                                -                                                                                                            ,-                                    java开发工程师 ,1年工作经验,上海,-目前在职，公司规模很小，在职员工只有个位数，请假不太方便，如果有面试希望能周末安排，十分感谢--,javaweb开发工程师,全职,上海,10k,15k,----税后8000以上都可以考虑---,,,{ 工作经历 :上海际扬通讯科技有限公司,2016.03 , 至今,java开发工程师,-主要负责web项目后端开发，以及负责一些前端页面逻辑的编写；开发的项目使用过的框架或技术包含：spring，springmvc，springjdbc，springboot，springdatajpa，mybatis，springsecurity；使用过数据库包含：oracle,mysql,h2使用的项目管理工具一直为maven;代码的管理工具为git;前端开发方式为：angularjs+html5+css；项目开发工具为IDEA.--;},{南京航空航天大学金城学院,本科 , 软件工程,2016年毕业;},{海口12345热线系统,在项目已有框架的前提下，填充新功能，以及根据客户要求进行修改,2016.04 , 2017.03,-海口市市政府12345热线服务系统，使用框架springmvc+springjdbc+angularjs--;杭州电力应急指挥官系统,已有的框架下，增加新功能以及根据客户要求进行修改（包含前端）,2017.02 , 至今,-一个坐席使用的调度台系统，使用框架springboot+springjdbc+angularjs--;},{angularjs,掌握;spring data jpa,掌握;spring jdbc,掌握;springboot,掌握;springmvc,掌握;},{}
6c2f1ddd47717b3409b0cb12cbebeab1, 网易传媒、百度大会、三星发布会、李宇春演唱会剪辑师 -                                    ,男,27岁,本科, 网易传媒科技（北京）有限公司-                            -                                                                            ,-                                后期制作 ,4年工作经验,北京,,剪辑师,全职,北京,10k,15k,-------,,,{ 工作经历 :古纳雅尔（北京）广告有限公司,2013.09 , 2014.10,视频编辑,-1、负责公司产品线中视频产品的剪辑和包装工作；2、负责客户视频项目的剪辑和包装工作；3、负责部分视频产品的策划和执行；4、负责网站首页视频栏目的更新与维护；5、负责微信公众账号的运营；6、负责其他视频相关的技术支持；--;北京模光范映文化传播有限公司,2014.11 , 2015.10,剪辑师,-1、就职于后期部门，担任剪辑师职务2、主要负责公司部分视频项目的剪辑、包装工作以及活动现场的视频素材管理；3、部分项目的后期分工管理工作；--;网易传媒科技（北京）有限公司,2016.01 , 至今,后期制作,-1、就职于内容部直播中心，担任后期制作-2、主要负责公司售卖项目后期支持、系列宣传片、直播中心二次传播视频制作；-3、负责部分项目的平面设计（海报、易拉宝、头图等）；-4、在职期间曾获1次总监奖、1次业务奖、1次团队三等功；--;},{南京航空航天大学,本科 , 生物医学工程,2013年毕业;},{百度《TheBIGTalk》,活动现场素材管理、全程剪辑、预热片和花絮集锦的剪辑包装,2014.11 , 2015.09,-《TheBIGTalk》关注商业、互联网及未来，以“科技改变世界”为宗旨，定期邀请以硅谷为代表的互联网前沿领袖级人物，到中国来分享他们的所思所想。--;《联合国秘书长潘基文对话李彦宏》,启动仪式部分的剪辑、部分包装字幕等及成片导出工作,2015.09 , 2015.09,-联合国秘书长潘基文正式访华，第一站活动是对话百度CEO李彦宏，共商国际合作、经济发展与环境保护，并回答百度贴吧网友提问。--;《我在天地中之嵩山问茶》（习近平访美携带）,全片剪辑及包装,2015.07 , 2015.10,-CRI中国国际广播电台举办《我在天地中之嵩山问茶》活动，邀请华裔学生来中国感受茶道文化。习近平访美之旅携带，在ABC美国广播公司播出。--;《李宇春-WhyMe2015成都演唱会》,现场4K素材整理、后期工程管理、演唱会前半程剪辑,2015.09 , 2015.10,-李宇春-WhyMe2015成都演唱会--;《2016天网直播战略发布会》,发布会暖场片、开场片、Top100宣传片等后期制作,2016.05 , 2016.06,-网易直播战略发布会--;《2016巴西里约奥运会》,节目包装,2016.08 , 2016.08,-包括竖版横版人名条以及新闻标题条的平面和动效设计--;《2016有态度人物盛典》,明星ID剪辑及盛典动效设计,2016.11 , 2016.12,-2016有态度人物盛典颁奖大会--;《2016教育金翼奖》,开场片剪辑及动态视觉、颁奖视觉设计,2016.12 , 2016.12,-网易举办的年度教育金翼奖颁奖大会--;《春运六个故事》,系列视频后期制作,2017.02 , 2017.02,-该项目获得公司团队三等功--;《迷航-MH370三周年纪念》,后期制作,2017.02 , 2017.03,-马航客机失联事件三周年纪念视频--;《网易公开课概念宣传片》,全片剪辑与包装,2017.04 , 2017.04,-网易公共课升级付费版本制作的概念宣传片--;《PGC节目H5售卖宣传片》,系列宣传片剪辑与包装,2017.04 , 2017.05,-包括以下PGC节目的H5宣传片：-《艾问》《二丢说旅行》《咖啡新说》《虾闯好莱坞》《miss欧洲》--;《高能少年团公益读书》,系列视频剪辑与包装,2017.05 , 2017.05,-包括张一山、王大陆、刘昊然以及董子健公益读书宣传视频剪辑与综艺化包装--;},{After Effects,专家;Photoshop,专家;Final Cut Pro X,专家;},{}
8c3f7bba496cf593bb46421762dbcda5, 摄影、画画、阅读、写作、手工、羽毛球等 -                                    ,女,24岁,本科, 南京墨者视觉工作室-                            -                                                                            ,-                                UI设计师 ,3年工作经验,杭州,-有良好的学习能力和工作主动性；注重细节，追求完美；严于律己，抗压能力强；积极乐观，有团队合作精神--作品链接-http://www.zcool.com.cn/work/ZMjI3NjAxODQ=.html---,UI设计师,全职,杭州,10k,15k,,证书,--英语专业八级-全国计算机二级（Msoffice高级应用）-普通话二级甲等---,{ 工作经历 :杭州以心绘梦电子商务有限公司（衣纱布菲）,2016.03 , 2017.06,平面设计师,--负责公司天猫旗舰店日常首页、详情页、活动专题页、H5等的设计与优化-负责新品选图、修图，制作日常banner和促销海报，进行文案构思及撰写----;南京墨者视觉工作室,2014.05 , 至今,UI设计师,--根据团队任务分配，参与APP、网页、logo、专题页等的策划与设计工作-根据客户需求，配合团队完成其他各类视觉设计工作，并提出建设性意见---;},{南京航空航天大学,本科 , 国贸英语,2016年毕业;},{恒康食品——官网主要页面改版设计,UI设计,2017.03 , 2017.04,--对网站首页、产品页、公司简介页等主要页面进行改版设计-运用响应式布局，调整PC端页面，进行移动端适配----;玛堡壁纸——官网整站改版设计,UI设计,2017.04 , 2017.05,--参与竞品网站分析、低保真原型图制作，确定网站的整体风格-独立完成首页、公司简介、品牌介绍、精彩视频等多个页面的制作-运用html语言和CSS样式实现网页布局以及简单的交互效果-负责任务分配、项目进度把控，以及团队成员之间的沟通交流----;ENJOY——APP研发设计,UI设计,2017.05 , 2017.06,--独立完成前期竞品分析、功能开发、内容策划，以及整体框架设计     -根据产品定位，独立完成logo设计，确定页面的主色调及整体风格-独立完成各个页面的设计，对整体视觉效果进行把控，并不断完善----;宠物圈——APP研发设计,UI设计,2017.06 , 2017.07,--参与前期用户行为流程和痛点分析、竞品分析、以及用户体验调查      -负责产品取名、LOGO设计，对页面整体色调和风格进行商定与把控-参与产品功能开发，独立完成多个页面的制作，并进行交互设计-负责任务的合理分配，进度把控，以及小组成员之间的沟通协调----;},{Axure,精通;C4D,精通;AE,精通;AI,精通;PS,精通;},{}
8a9c03c9a659ac43269c1b52e09edab1, 负责任，并快乐着。 -                                    ,男,32岁,硕士, 上海深耕投资管理有限公司-                            -                                                                            ,-                                数据挖掘工程师 ,6年工作经验,上海,,,,,,,,,,{:},{},{},{},{}
4903ab8e7c80f63ece808a02eba59678, 扎根创业团队，全面发展，运营、产品通通搞的定！ -                                    ,男,,本科, 携程旅行网-                                -                                                                                                            ,-                                    产品/运营经理 ,2年工作经验,上海,-挑战、挑战！自从来到这个世上，就没打算活着回去，放手去做！-沟通、协调！部门年度最佳人缘奖，一双眼睛+两只耳朵=我懂你！--,产品经理,全职,芜湖,10k,15k,,,,{ 工作经历 :携程旅行网, , ,产品/运营经理,;上海乐愉实业有限公司,2013.07 , 2014.02,电商运营,-担任京东商城母婴类目店铺--思奈母婴专营店店长，全面负责店铺运营工作，对店铺的PV、UV、转化率及销售额负责。任职期间，将店铺的销售额从6月份不足20万，提升至2月份的150万+。--;携程旅行网,2014.02 , 至今,产品/运营经理,--担任部门运营经理，负责高尔夫项目的运营工作，对部门开发的APP-爱玩高尔夫的用户新增、用户活跃度及留存率等关键性指标负责；-2014年末，开始参与产品工作，创造性地提出“让用户混圈子（球队）”的idea，得到领导及团队的一致认同，并进行需求分析与论证，交互原型的输出，产品开发进度的协调及测试工作。-- --;},{南京航空航天大学,本科 , 信息与计算科学,2013年毕业;},{},{mindmanager,精通;excel,精通;axure,精通;},{}
bdc5233eadb10479cb80f8274698f15e,,女,24岁,本科,,,2年工作经验,南京,-本人已婚已育，会计知识扎实，熟悉报税流程--,会计,全职,南京,2k,5k,,,,{:},{南京航空航天大学,本科 , 会计学,2018年毕业（预计）;},{},{},{}
97ae4eb5442ecb17d40e8b5cd0d2c695, 10年MKT经验，500强外企、国际市场、创业团队经验。 -                                    ,女,34岁,硕士, 华为终端有限公司-                                -                                                                                                            ,-                                    Senior Marketing Manager ,10年以上工作经验,深圳,,市场营销,市场总监,全职,杭州,40k,50k,,,,{ 工作经历 :广州市浪奇实业股份有限公司,2004.06 , 2008.03,市场专员,;广州市浪奇实业股份有限公司,2008.03 , 2010.06,市场主管,--负责产品的品牌发展策略、产品线规划、年度推广计划，达成市场表现、销售额、产品毛利、费用投入产出比等目标。--产品涵盖7个品牌、12个品项。所负责产品2009年目标市场分销率达到目标的95%，销售额达到2.08亿元，较同期增长36%，产品毛利额较2008年增长7%。-联合供应链、研发部、包装设计进行新产品开发，优化产品线，制定产品价格体系。-联合媒体和PR小组，制定产品年度推广计划、新品上市计划，负责大型市场项目，如大型路演、户外主题活动等。对销售部培训并紧密合作确保线下计划的执行。-负责线下市场费用的预算、管控和评估，优化投入产出。---;3M中国有限公司,2010.06 , 2011.08,Senior Marketing Executive,--负责思高(Scotch-Brite)和高曼（Command）品牌下7个品类200余个产品在南区（10个省1个市）的市场策略和市场推广；提高品牌认知；提升销售额和POS.--思高品牌南区重点城市市场占有率第一（数据来源：尼尔森报告）。--2011年上半年同期对比销售额增长31%，POS增长90%；-负责南区年度线下市场计划、品牌活动、新品上市推广和产品促销计划，和销售团队紧密协作确保执行。--制定2011年南区线下市场计划；负责渠道的品牌推广项目，如3M体验馆、3M主题促销、3M路演等；制定南区年度季度月度产品促销方案。-负责市场费用预算和评估，优化投入产出。2011年上半年同期对比费用比降低2.8%。-分析市场数据和信息，判断市场现状和市场趋势。分析POS数据、外部市场调研和销售团队反馈信息等，作为市场策略的支持。-优化市场表现，包括品牌形象、店内陈列等，制定相关标准，定期给销售团队培训，并确保执行。至2011年6月，南区终端陈列和品牌形象改善95%.-其他市场项目。如重点城市计划、南区家乐福计划、促销团队产出优化计划等。-主导跨部门协作，和零售商、经销商良好沟通，和广告、礼品供应商良好合作。---;Sponia Ltd.,2013.06 , 2014.09,市场总监,--负责品牌策略和推广计划，并确保执行；针对目标用户群提升品牌和产品认知；增长用户数量和活跃度。--根据产品进度，制订媒体投放计划并执行。累积有36Kr、PingWest、ifanr、数字尾巴、最美应用、足球周刊、PPTV等10多家线上媒体、平面媒体对“洋葱圈”报道和传播；--负责创意内容的策划和执行。如产品视频、平面广告、事件营销、线上活动等；--运用社交媒体营销，实现产品沟通和推广，增加品牌曝光和用户数量；--负责应用渠道的分发和推广。联合渠道商进行首发、活动等合作，如豌豆荚首发、小米首发、91助手抽奖活动，360助手体育主题推广，最美应用设计奖等；--产品内主题活动及话题策划。如洋葱圈最美球衣背影、球赛竞彩等。-开展行业内外合作，整合资源，以最优投入产出达成市场目标。--体育界资源合作。如体育数据商、体育论坛、体育名人等合作；--广告投放渠道合作。如PPTV的W酒店亚冠之夜合作；--跨界合作。如户外品牌Vibram的内容合作、泰国知名体育插画师合作等。-负责市场数据分析和费用管理，总结执行效果，判断市场现状和趋势。分析用户增长、活跃度、渠道占比、转化率等关键数据，进行用户调研和市场容量评估。-管理市场团队，注重团队的分工协作，注重成员的能力培养。---;华为终端有限公司,2015.09 , 2017.03,Senior Marketing Manager,--2016年绩效分别为A和B+.-负责某旗舰系列平板全球产品策略。挖掘产品KSP/USP,Consumerbenefit；分析市场数据、用户调研、舆情报告等信息，确立产品定位、目标人群、Messagehouse等营销策略。针对某款2016年上市产品：--通过研究典型用户场景和痛点，分析竞品特征，整合顶尖合作品牌资源，提炼清晰的差异化卖点，以加深此产品系列独特的品牌/产品印象。上市后销量较上代产品大幅增长，上市后调研显示此差异化卖点为Top1购买决策因素。--重新界定产品定位和目标人群。上市后调研验证目标人群的调整基本准确。-统筹MKT项目组，支撑新产品的成功上市。和AD,PR,Digital,Media等其他部门密切合作，确保整合营销传播策略的有效性和一致性。--确保创意内容和传播方式符合产品策略，包括不限于KV,Video,Socialpost,webpage,PRtoolkit等。Brief内部项目团队和供应商，全程参与各内容从概念到交付的过程。--做好上市项目管理，确保项目进度、交付质量和资源协调。-同产品线、销售、零售等跨部门协作和沟通，及时获取各领域信息，同步调整MKT策略，并确保MKT策略在销售和零售领域的延续性。-负责产品全球发布会Keynote材料。--负责M210.0,MateBook和M3在CES,MWC,IFA的发布会Keynote材料。--精炼产品故事，KSP,ConsumerBenefit,以最佳角度和逻辑阐述，并以最美方式呈现。-全球重点国家和区域的支撑。--上市前充分沟通产品策略，并在有本地化产品策略需求的情况下，予以支撑。--沟通区域市场传播计划，给出有效建议。阶段性总结传播效果，收集最佳案例进行推广。---;},{南京航空航天大学,本科 , 法学,2004年毕业;中山大学,硕士 , MBA,2013年毕业;},{HUAWEIMediapadM38.0GTMProject,Product Marketing,2016.04 , 2016.11,-平板旗舰产品全球上市项目，主要涉及以下三个方面：--根据市场数据，消费者调研，竞品分析等信息，制订产品和市场策略；-统筹MKT项目组，协调资源，把控项目进度和质量，确保创意内容和传播方式符合市场策略；-全球重点区域和国家的支撑。---;},{},{}
ee239c451ab0c642da94f4ce231276a1, 认真工作，快乐生活 -                                    ,女,26岁,本科,,,3年工作经验,上海,,,,,,,,,,{:},{},{},{},{}
217589fb8dabeef780f7f44e34be4b72, 越努力，越幸运！ -                                    ,男,27岁,本科, 杭州双收网络技术有限公司-                            -                                                                            ,-                                网页/UI设计师 ,4年工作经验,杭州,,网页设计师或ui设计师,全职,杭州,5k,10k,,,,{ 工作经历 :安徽峰托金融投资有限公司,2013.06 , 2014.08,销售代表,--了解产品，定位不同的客户群，销售金融产品---;宁波蒂凡尼服饰有限公司,2014.09 , 2015.08,店铺运营,--店铺装修，banner、宝商品详情页制作，销售文案，物品上下架，数据统计-了解电商发展趋势，参加各电商平台活动，指导用户打理淘宝店-商品发货，处理售后---;杭州双收网络技术有限公司,2015.09 , 至今,网页/UI设计师,--负责各种企业站、官网网站项目页面整体设计-负责PC端商城网站及移动端APP项目UI界面整体UI设计-负责项目中各种交互界面、图标、LOGO、Banner、海报、易拉宝、画册、按钮等相关元素的设计与制作-企业网站、电商网站Div+CSS+JS静态前端页面实现-协助公司官网SEO优化，网页页面更新、推广---;},{南京工业职业技术学院,大专 , 计算机网络技术,2012年毕业;南京航空航天大学,本科 , 计算机网络工程,2013年毕业;},{B2C服装商城+手机APP,UI界面设计,2016.01 , 2016.05,--一款主营服装类电商PC网站+移动端APP商城-主要负责整个项目的网站页面设计及移动端UI界面设计-界面交互及用户体验---;B2B家具商城+移动端APP,UI界面设计,2016.05 , 2016.09,--一款主营家具类商城PC网站+移动端APP商城-根据用户需求，结合用户体验，设计出交互草图-主要负责整个项目的网站页面设计及移动端UI界面设计---;B2B海外代购商城+移动端APP,UI界面设计,2016.09 , 2016.12,--主要是海外代购及发布商品、自营商品的商城PC网站+移动端APP-根据用户需求，结合用户体验，设计出交互草图-负责整个项目的网站页面设计及移动端UI界面设计---;企业网站、公司官网,网页界面设计,2015.10 , 2017.02,--不同行业的网站需求，金融、教育、产品、运输、商城、家具...-网站项目整体页面设计-Div+CSS+JS前端静态页面实现---;},{Axure,掌握;DW,掌握;AI,精通;PS,精通;},{,;,;,;,;,;,;,;www.51daima.com,一部分设计上线的PC网站+移动端APP已上传到公司官网;}
02c65026899d9765d3fbe0df12358230, 在平坦的路面上曲折前行 -                                    ,男,25岁,本科, 南京我乐家居股份有限公司-                                -                                                                                                            ,-                                    市场策划 ,2年工作经验,南京,,市场,全职,北京,10k,15k,,,,{ 工作经历 :A.O.史密斯,2014.06 , 2014.09,网页设计师,-电商平台网页设计工作--;苏宁云商,2015.02 , 2015.04,管理培训生,-总部管理培训生（设计中心）--;南京我乐家居股份有限公司,2015.04 , 2016.04,电商运营部经理,-负责我乐厨柜天猫官方旗舰店的运营工作，领导部门员工7人（基础运营、文案、推广、网页设计），帮助店铺取得2015年双十一厨柜类销售冠军--;南京我乐家居股份有限公司,2016.04 , 至今,市场策划,-策划全国促销活动；策划事件营销活动；主导杂志编排、视频制作、店面物料、品牌宣传等物料创意；市场调研及竞品分析；大型落地活动的执行等--;},{南京航空航天大学,本科 , 公共事业管理,2015年毕业;},{十一周年厂庆落地活动,整体策划,2016.07 , 2016.08,-策划并执行十一周年厂庆促销方案及落地活动（南京国展中心）--;高圆圆签约我乐代言发布会,策划,2016.09 , 2016.10,-策划并执行高圆圆签约我乐代言发布会相关工作--;天猫双十一,运营经理,2016.09 , 2016.11,-领导运营团队取得厨柜品类天猫双十一冠军，线上成交累计1.15亿--;企业宣传片,策划执行,2016.11 , 2016.12,-负责2017年公司企业宣传片的策划、拍摄、制作工作--;KOL大号营销,策划,2017.01 , 2017.02,-策划微信大号推广高圆圆TVC，播放量20万+--;欢乐颂产品包装,内容策划,2017.03 , 2017.04,-包装我乐新品“欢乐颂”系列，包括物料创意、卖点提炼、推广策略等--;欢乐颂Social城市路演,活动策划,2017.04 , 2017.05,-策划全国十大城市“欢乐颂”主题路演路演活动--;},{Office,精通;Dreamweaver,掌握;AI,掌握;视频剪辑Final cut pro,掌握;Photoshop,精通;},{}
37670cde00845431e2a23dbd76080bea, UI想转产品，求一份产品助理的工作。非常感谢！阅读我的简历。 -                                    ,男,24岁,本科, 南京航空航天大学-                             -                                                                            ,-                                软件工程 ,2年工作经验,上海,,,,,,,,,,{:},{},{},{},{}
8b7e58772a2902e112e96e7927ca8a24, 英语专业本科，做了5年专职翻译，现希望能兼职做审校 -                                    ,女,,本科,,,5年工作经验,成都,,英文笔译审校,兼职,成都,5k,10k,,,,{ 工作经历 :江苏舜禹四川分公司, , ,英文笔译,;江苏舜禹技术有限公司成都分公司,2012.06 , 至今,英文笔译,-负责翻译和审校华为及腾讯专利稿件--;},{南京航空航天大学,本科 , 英语,2012年毕业;},{},{},{}
