做过操作系统课外实验，模拟进程调度（c语言、团队合作2人）；操作系统课程设计，模拟操作系统资源配置读者写者，同步管程机制（java、团队合作2人）；数据库系统光盘出租（c#、团队合作5人）。--,软件工程师,全职,南京,10k,15k,-------,,,{ 工作经历 :深圳珠海赞同科技有限公司,2014.04 , 至今,软件工程师,-公司作为外包公司，为银行需求开发银行项目，属于互联网金融，从工作到现在接触到的有前端后台。相关业务有第三方，b股，徐州公转商，社保医保特色系统，行政服务中心，工资代发，缴费代扣等--;},{南京农业大学,本科 , 网络工程,2014年毕业;},{上海交通银行531项目,第三方存管 b股签约 对公签约,2014.04 , 2014.10,-前端维护，相关证券公司签约，前端的控制查询，使用技术为flex，java等--;南京交通银行531项目,公共事业代缴费常州烟草测试以及前端缺陷修改,2014.10 , 2015.04,-常州烟草是公共事业代缴费其中的一个模块，公共事业代缴费包含水费，电费，燃气费，电信费，移动电话费，联通话费，有线电视费等相关费用由银行代扣，本业务包含了柜面，自助通，网银，手机银行，生活馆，电话银行等渠道可以进行代缴费业务，该项目将各个分行可以统一的代缴费都统一规划，其余各个分行另外有自己特色的交易，常州烟草，其中包括特色的签约，撤约，查询，打印等功能，使用技术为java flex,python--;南京交通银行531项目,公共事业代缴费常州一卡通前端开发测试,2014.10 , 2015.04,-常州一卡通是公共事业代缴费其中的一个模块，公共事业代缴费包含水费，电费，燃气费，电信费，移动电话费，联通话费，有线电视费等相关费用由银行代扣，本业务包含了柜面，自助通，网银，手机银行，生活馆，电话银行等渠道可以进行代缴费业务，该项目将各个分行可以统一的代缴费都统一规划，其余各个分行另外有自己特色的交易，常州一卡通，其中常州一卡通系统包含客户的委托代扣关系的查询，建立，删除，以及关系的变更，欠费查询，发票的打印补打，特别数据的代扣的停止处理，清除未扣款的记录等等一些交易，使用技术为flex java python--;南京交通银行531项目,江苏省各个省辖行社保医保系统前端开发以及测试,2014.10 , 2015.04,-由省市各个人力资源和社会保障局与交通银行联合开发，集社会保障卡和银行卡功能为一体的智能芯片，为实现社保卡的原有的功能且又能满足金融交易的需求，并且提升分行业务发展管理水平，减少各个分行对社保养老医保系统开发维护工作量，改变社保养老医保业务管理系统并存模式，整合和统一各分行社保养老医保业务系统，形成适应全行社保养老医保业务发展的管理软件。现社保医保系统分为三大模块，社保批量开卡模块，社保卡公共管理模块，社保医保代收付模块，使用技术为flex java，和基于spring框架的后台平台基制--;扬州社保信息修改,前端开发,2015.05 , 2015.06,-根据社保中心提供的修改单，参保人员申请修改本人的人员编号，或者本人身份信息如身份证号码，姓名等，通过该交易，实现实时更新金融社保卡信息对照表或失地农民信息对照表，使用的技术有java，flex，基于spring框架的后台，db2--;徐州公转商项目改造优化,徐州公转商项目进行优化改造，我负责其中的三个功能的前端和后台,2015.02 , 2015.10,-为了满足徐州市民日益增长的住房贷款需求，银行方与住房公积金管理中心合作，创新性的开办个人公转商贷款，公转商贷款是由借款人因买住房需要申请贷款，经公积金中心审核同意承担因商业性住房贷款和住房公积金贷款利率不同产生的利息差，其中包括具体的交易内容包括贷款数据的导入和发送至第三方，贴息数据的处理，提前还款处理，还款卡号的变更，利率的调整，期数缩短，报表的操作，黑名单等，我负责项目中的更新还款计划表，查询当期未还清单，上传和下载还款计划交易，使用的是银行的jump平台，技术包括jsp和java，利用ajax进行数据的传输--;江苏省分行财政集中支付业务优化,负责财政集中支付前端的开发,2015.07 , 2015.10,-为了进一步的提升财政资金支付的安全和效率，对现有的财政支付系统进行改造，本系统开完完成后，可通过柜面人工预先录入支付系统行号，交换号，选择支付路径，实现地方财政直接支付全程电子柜员自动处理，尽量减少柜员人工干预得工作量。此次改造的交易包括28901支付记账，财政支付抹帐，支付系统行号补录，直接支付记账批次生成，直接支付记账，直接支付补记账，支付系统行号维护，直接支付批次控制维护。授权支付他行转账交易等，使用技术有flex java python--;江苏省分行南京市浦口区财政国库集中支付系统优化,负责浦口财政优化需求前端开发,2015.08 , 2015.10,-根据浦口区财政局区级财政国库集中支付清算接口改革流程方案，对满足浦口区财政业务需求，提高工作效率，降低业务差错率，增强财政资金安全性，对浦口区财政集中支付系统进行优化改造，其中包含的交易包括财政支付复核，行号补录，记账批次生成，直接支付记账，直接支付补记账，支付系统行号维护交易，支付系统刚行号信息导入导出，直接支付无纸化分批记批次号查询等--;扬州财政津补贴代发,前端开发，以及测试和后台的修改,2015.09 , 2015.10,-银行方和扬州财政联合开发的，由财政部门统一发放机关事业单位的津补贴，每月由财政发送数据至行方，由行方对财政发来的数据进行校验核对和处理，生成文件后进行统一批量的代发津补贴，并且提供打印，查询交易等以供柜面查看，使用技术flex java python --;灵活就业人员通过微信实现实时缴费系统项目,前端开发以及测试，缺陷修改以及完成后台我的南京对账功能,2015.07 , 2015.11,- 社保中心提出借助微信开放平台，实现自由职业者社保缴费的通道，支持绑定社保帐号，缴费，查询，代扣，调整缴费基数等功能，减少自由职业者去网点缴费的复杂手续，提高政府单位办事效率，完成的功能有客户信息认证，当期缴费明细查询，微信支付和对账，并且可以打印或者查询社保方，微信方和银行方之间的差异数据，使用的技术有flex,java,基于spring框架的java开发后台，db2--;泰州分行烟草代扣,负责前端的开发,2015.10 , 2015.11,-建立烟草公司系统与银行方业务平台的信息互联，实现银行账户扣款信息与烟草公司系统信息交换。烟草公司客户可以通过在银行方办理的太平洋卡或者结算账户（个人借记卡，单位结算卡，单位结算账户，bbos贷记卡）对其进行账户余额的查询，扣款等，扣款成功后烟草公司将客户的烟草陪送上门。该系统可以满足烟草代扣关系的建立，删除，修改，并且可以进行账户余额查询，并将帐务流水发送至第三方。使用的技术java flex python，具体的交易签约代扣协议，删除代扣协议，修改代扣协议，发送通知书，打印报表，余额查询，和第三方进行帐务核对对账，联机实时代扣等--;江苏省盐城银社通平台系统,前端开发，后台开发前端测试，和社保联调测试，以及后台前端缺陷,2015.10 , 2016.01,-为加强与盐城市社保中心合作，通过我行缴纳保险金，或者给参保人员发放待遇，推进银行的个金业务，实现两类服务，查询服务和结算服务。其中结算服务包括单笔的结算和批量的结算。具体的交易包括单笔缴费或者单笔支付，对应单笔缴费的冲正，批量数据的代扣，代发，批次信息的查询，打印，代扣协议的维护，个人参保信息得查询，社保账户信息得查询，应缴金额得查询，行方和社保方对账等功能，使用的技术java，flex,基于spring框架的后台，db2--;交通银行常州分行银社通平台系统,后台部分功能开发测试修改，前端开发测试,2015.11 , 2016.01,-为了加强与常州市社保中心的合作，行方与常州分行，常州人社局合作。实现为参保人员缴纳保险金或者发放待遇得查询和结算业务，本次开发的系统基于常州分行的业务需求。包含查询服务和结算服务。具体的交易包括单笔缴费，单笔缴费的冲正。单笔支付，批量代扣代发的业务，批量代扣代发批次状态的查询，代扣代发的结果的查询和打印，个人参保信息查询，社保账户信息查询，交易明细查询，应缴金额的查询，代扣协议的维护包括新增，删除和查询当前的代扣协议的状态，以及帐务流水行方和人社局的对账交易。使用的技术包括java，flex，基于spring框架的后台，db2数据库--;交通银行江苏省分行镇江分行银社通平台系统,后台部分功能开发测试修改缺陷，前端开发,2015.09 , 2016.03,-银社通平台是交行镇江分行与镇江人社局合作，实现为参保人员缴纳参保费或者为其发放待遇的查询以及结算服务的平台，这个平台包含两部分服务，查询服务和结算服务。具体的交易包括单笔缴费和单笔缴费冲正，单笔支付和单笔支付冲正，批量代付的业务，以及对于已经存在的批量代扣的业务进行改造，查询批次的信息，批次代扣代发的结果，代扣协议的查询，单笔支付状态得查询，应缴金额的查询，和帐务流水的对账，使用的技术flex,java,基于spring框架的后台，db2数据库--;城市商业银行资金清算中心支付清算系统,柜面通，汇兑，账务务类后台开发，测试，,2016.01 , 2016.12,-城商行支付系统是要建设一个资金清算中心为核心，资金清算中心和各城市商业银行之间的专用网络为基础，连接各城商行的行内系统，以电子支付清算业务为重点，城商行刚行内柜面系统，资金清算中心网上银行，第三方支付组织等各种交易渠道为手段，在城商行与城商行，城商行与其他金融机构，城商行与第三方支付清算组织之间，实现支付指令的传送和资金清算的综合性电子支付平台。并成为城商行与城商行，城商行与其他金融机构之间加强合作的重要基础设施。--;南京银行261项目改造,后台开发,2016.11 , 2016.12,-人行规定银行间转账可以选择24小时到账，24小时之内可以撤销，为支付项目增加新的滞留交易-二三类账户的改造，人行规定一名客户在银行只能有一个主账户，其余都是二三类账户，二三类账户存在交易金额等支付限制-目的在于防止电信诈骗---;江南银行财政集中支付,后台开发测试 项目设计 数据库设计,2017.01 , 至今,-国库集中支付制度和国库集中收缴制度共同构成了国库集中收付制度。国库集中收付制度是指政府将所有财政性资金都纳入国库单一账户体系管理，收入直接缴入国库或财政专户，支出通过国库单一账户体系支付到商品和劳务供应者或用款单位。逐步建立和完善以国库单一账户体系为基础，资金缴拨以国库集中收付为主要形式的财政国库管理制度，是整个财政管理制度改革的有机组成部分和主要内容。-江南银行财政集中支付项目，将常州，江苏金坛，两个财政进行合并开发，项目内容包括支付凭证的接收，额度明细的接收，清算信息的发送给财政，对账，退库信息发送给财政，以及银行的特色交易，垫付类，委托垫付类，开停工系统控制，等--;},{db2 sqlserver,掌握;flexq unix,熟悉;java JavaScript html,掌握;python c c#,了解;},{}
f5d48a7f4a037e0b5f7471aefbf31944, 学习能力强,沟通协作意识好 -                                    ,男,,本科, 大连圣迪科技有限责任公司-                                -                                                                                                            ,-                                    ios开发工程师 ,3年工作经验,深圳,,,,,,,,,,{:},{},{},{},{}
138406a599796ea3f9989627819c82d8, 对新鲜事物敏感和对传统农业的实践积累，是我的优势。 -                                    ,,,硕士, 中节能绿碳环保有限公司-                                -                                                                                                            ,-                                    产品经理 ,3年工作经验,北京,,,,,,,,,,{:},{},{},{},{}
7b7294ac5286730fbcb29c0a1bc1efb9, 工作3年，凭借卓越的学习能力和适应力，已有20人团队管理经验 -                                    ,男,,本科, 叮当快药北京科技有限公司-                                -                                                                                                            ,-                                    药师主管 ,3年工作经验,北京,,,,,,,,,,{:},{},{},{},{}
aab96bd11dd6e1c28ca3b149e82663ab,,女,,本科,,,3年工作经验,海口,,,,,,,,,,{:},{},{},{},{}
c23cfa546f8b0ca2afab6b661e739236, 熟练运用excel多种函数和数据透视表，对数字敏感，善于沟通。 -                                    ,女,,本科, 北京航天世景信息技术有限公司-                                -                                                                                                            ,-                                    人力资源管理专员 ,3年工作经验,北京,,,,,,,,,,{:},{},{},{},{}
b90f7ee36c6ff120c1dbba3b59c5c5d0, 2年基地生产管理经验，掌握生产台账及大型办公平台的运用。 -                                    ,,,本科, 浙江森和种业股份有限公司-                                -                                                                                                            ,-                                    技术员 经理助理 ,3年工作经验,重庆,,,,,,,,,,{:},{},{},{},{}
8fa5e60ffd6491ab28904cba5ce1be78, 相信自己，为生活而奋斗拼搏，为梦想而超越自己！ -                                    ,男,25岁,本科, 随变科技-                                -                                                                                                            ,-                                    Android开发工程师 ,3年工作经验,北京,,,,,,,,,,{:},{},{},{},{}
005d7955fc59fc1c6a57b7a6523c71bc, 3年软件测试经验，大型项目测试把控，有责任心，学习能力强 -                                    ,,,本科, 思科系统（中国）网络技术有限公司-                                -                                                                                                            ,-                                    软件测试工程师 ,3年工作经验,上海,,,,,,,,,,{:},{},{},{},{}
415b4ae32c725096337c7ac9001f15c4, 2年半的测试经验，学习能力强，负责 -                                    ,女,,本科, 亿方德（北京）科技有限公司-                                -                                                                                                            ,-                                    软件测试工程师 ,3年工作经验,北京,,,,,,,,,,{:},{},{},{},{}
61740e16b2eafda09aaa9361f1b294a7, 执着，上进，抗压力强，热爱人力资源的工作，拥有互联网人脉资源 -                                    ,男,,本科,,,3年工作经验,上海,,hrbp,全职,上海,10k,15k,,,,{ 工作经历 :东方融资网, , ,组织发展主管,;},{南京农业大学,本科 , 公共事业管理,2014年毕业;},{},{},{}
fd379123262d1014530eb3d481f7c3c4, 3年软件APP测试经验，负责多个项目测试 -                                    ,女,26岁,本科, 展讯通信（上海）有限公司-                                -                                                                                                            ,-                                    软件测试工程师 ,3年工作经验,上海,,,,,,,,,,{:},{},{},{},{}
61da53a49945f91f0b854c4b9a6cfac4, 只有为公司平台创造价值，才是自己价值的体现！ -                                    ,,,本科, 南京诺远资产管理有限公司-                                -                                                                                                            ,-                                    理财经理和团队经理 ,3年工作经验,深圳,,,,,,,,,,{:},{},{},{},{}
35606e5e1a548ebf54e81e986faaa224, 专业知识扎实，近三年工作经验，注会专业阶段通过，党员。 -                                    ,女,27岁,本科,,,3年工作经验,北京,-专业知识扎实，有近3年工作经验，注册会计师考试专业阶段通过，学习能力、理解能力强，为人勤奋上进。--,会计,全职,青岛,5k,10k,,,,{ 工作经历 :山东和实集团,2014.01 , 2014.03,出纳,-担任出纳，主要负责收付款业务，登记日记账、费用报销、固定资产盘点、金蝶EAS数据录入等工作。--;济南世纪华联集团,2014.10 , 2015.05,核算会计,-1.月底做供应商结算单、费用单；-2.月底制作毛利构成表、经营利润表；-3.分析本月财务数据变化，撰写分析报告；-4.大型活动时，设置活动编码、活动系统；-5.日常为采购部门、营运部门提供可靠数据。--;中天运会计师事务所,2015.06 , 2017.06,审计师,-在本单位工作期间，主要工作是进行年审、中期审计、税务鉴证，以及一些专项审计。其中时间最长的是云帆项目IPO审计，对于该项目进行三年一期财务报表审计，参与两次年审、两次半年审计。在这些项目中，主要负责检查各单位账目，编制审计底稿，以及与被审计单位沟通，获取相应的审计证据，协助项目负责人出具审计报告。--;},{南京农业大学,本科 , 会计学,2014年毕业;},{税务鉴证,助理审计师,2015.04 , 2015.05,-对于该单位税务鉴证业务，主要负责检查各类原始单据，检查税前扣除项是否合理，以及收入的完整性，协助经理出具审计报告。--;专项资金审核项目,助理审计师,2015.10 , 2015.12,-主要负责对商务部提供的资料，按照规定进行检查，对于不符合标准款项，上报项目负责人，经过审核后予以核减。--;净资产审计项目,助理审计师,2016.04 , 2016.05,-负责编制关键底稿，检查收入、费用的真实性、完整性，资产、负债的完整性、准确性，结合资产评估人员的工作进行资产盘点，协助经理出具净资产报告。--;法方撤资专项,审计师,2016.10 , 2016.12,-对该项目930报表审计，主要负责对两家子公司损益类科目实质性底稿的编制；对收入确认流程、收入费用结构、变动情况进行分析，是否跨期进行检查；进行存货盘点、生产成本结构分析。--;展会收支专项,审计师,2016.11 , 2016.12,-基于雅森与中贸联合办展，受中贸委托，对雅森展会中发生的收入与费用的真实性、完整性进行审计；检查收入费用的合同、发票以及其他原始单据，核算出符合标准的真是收入费用。--;云帆IPO审计项目,审计师,2015.06 , 至今,-1.云帆IPO项目：对于该项目进行三年一期财务报表审计，参与了两次年审、两次半年审计，每次负责八九家分子公司各科目实质性底稿、内控底稿的编制；与企业沟通获取各种审计证据、实施相关审计程序；检查各家单位账务处理是否规范，并对不恰当的做法进行沟通调整；协助项目经理编制报表、附注；对于不能解决的问题及时与项目经理、现场负责人沟通。--;},{CET6,精通;计算机二级证书,掌握;},{}
3fe6eb6bdd72587331811eb2b0375cef,,男,26岁,本科, 云络网络科技-                            -                                                                            ,-                                Linux&Network Engineer ,3年工作经验,上海,--较强的学习能力-严谨的工作态度-优秀的团队合作-出色的人际沟通---,openstack,Linux,Network,全职,上海,15k,25k,,获奖经历,--CCIE#41000思科认证网络专家-2012-南京农业大学优秀共青团员-南京农业大学2014届优秀毕业生---,{ 工作经历 :江苏达科信息科技有限公司,2014.03 , 2016.03,Network Engineer,--运营商级网络设计&部署-数据中心IDC网络设计&部署-企业级网络设计&部署---;云络网络科技,2016.03 , 至今,Linux&Network Engineer,--Zabbix监控平台维护-OpenStack内部项目部署&维护-AWS&Aliyun公有云平台上Web/APP架构设计及维护-公司内部网络设计&客户公有云/私有云网络架构设计---;},{南京农业大学,本科 , 计算机科学与技术,2014年毕业;},{江苏联通跨域MPLSVPN承载网总部出口改造,网络调研 方案撰写 客户沟通 项目实施 后期维护,2015.10 , 2016.07,--江苏联通MPLS承载网总部出口升级，由原两台GSR12016升级为两台ASR9010-VPN的路由优化与流量调整-升级江苏省13个地市两台PE下挂的承载网---;日日煮DayDayCook,性能优化 应急处理,2016.03 , 至今,-由云络团队负责日日煮APP大陆站点/香港站点的设计，部署与维护。-其中大陆站点为主用站点，香港站点为备用站点，在故障发生时通过DNS智能切换主备--;澎湃新闻thepaper.cnIDC机房迁移至云/后期运维,架构设计 系统搭建 后期优化 应急处理,2016.03 , 至今,-为满足业务增长的需要，实现高可用弹性架构，澎湃新闻由传统IDC环境迁移到阿里云平台。-系统架构：-CDN->AliyunSLB->WAF->Haproxy->Nginx->Tomcat->Memcache/Redis->Mysql---;赞那度Zanadu旅游网站上线/维护,架构设计，网络优化，应用优化，应急处理,2016.06 , 至今,-云络团队负责Zanadu网站的上线及运维,以及客户办公室网络和阿里云VPC网络的打通-系统架构：-CDN->AliyunSLB->Web->db(Mysql+Mongo)->NFS---;内部OpenStack实验项目,文档翻译，架构设计，项目实施，后期维护,2016.08 , 至今,-因个人兴趣，向公司申请4台闲置Dell430服务器搭建OpenStack(侧重点在neutron-network)环境，其中1台控制节点，2台计算节点，1台块存储节点。实现了基本的虚机创建与管理，负载均衡，安全组等功能。--;梨视频PearVideo上线实施/运维,架构设计 系统搭建 应用优化 应急处理,2016.09 , 至今,-该项目为云络团队为梨视频在阿里云上打造的集视频点播，直播，分享等功能的平台。-系统架构：-CDN->AliyunSLB->WAF->Haproxy->Nginx->Tomcat->Memcache/Redis->Mysql---;},{KVM Virtualization,熟悉;Python,掌握;OpenStack,掌握;Linux,精通;Network,专家;},{}
5062c73a39162af742188766baa16810, 工作努力，踏实，学习能力强 -                                    ,男,,本科, 深圳市商之杰电子商务有限公司-                                -                                                                                                            ,-                                    android软件工程师 ,3年工作经验,深圳,,,,,,,,,,{:},{},{},{},{}
d4e818cec8ec55b99d4b4d8ffaf184b7,,男,29岁,本科, 考拉fm-                            -                                                                            ,-                                交互设计师 ,3年工作经验,北京,,,,,,,,,,{:},{},{},{},{}
9aed69ef2c54dd5ac20c7bfe7ae5792a, 稳重务实,工作认真负责,有团队合作精神，进取心强。 -                                    ,,,硕士, 广东温氏食品集团股份有限公司-                                -                                                                                                            ,-                                    畜牧师、场长 ,3年工作经验,广州,,,,,,,,,,{:},{},{},{},{}
3d6561e5ab53640e0289a4f02f09813d, 3年半JAVA WEB开发经验，具有扎实的基本功，工作认真负责。 -                                    ,男,,本科, 上海晖硕信息科技有限公司-                                -                                                                                                            ,-                                    java工程师后端 ,3年工作经验,上海,,,,,,,,,,{:},{},{},{},{}
452f82d93655ee11757004cbc3dbd3f5, 喜欢看书、交友、运动，热爱软件行业 -                                    ,男,,本科, 四川长虹网络科技有限责任公司-                                -                                                                                                            ,-                                    软件开发工程师 ,3年工作经验,成都,,,,,,,,,,{:},{},{},{},{}
a1108670f34a22d2ef212d6c86035a66, 工作有激情，刻苦钻研，有上进心 -                                    ,男,26岁,本科,,,3年工作经验,南京,,,,,,,,,,{:},{},{},{},{}
