cb568834a3540275c81f157da5e96032, 技术、销售、市场、管理都涉猎，产品和人脉广，学习能力强 -                                    ,男,33岁,硕士, 百度在线网络技术北京有限公司-                            -                                                                            ,-                                高级渠道经理 ,10年以上工作经验,北京,,总监或部门经理,全职,北京,25k,50k,,,,{ 工作经历 :中铁电气化局城铁公司,2007.07 , 2009.07,技术工程师,-作为现场技术支持工程师，参与北京地铁机场线项目，完成SCADA及开关柜的调试，辅助项目经理管理，具有项目管理经验。--;施耐德电气（中国）有限公司,2009.08 , 2013.03,销售工程师,-大客户销售经理&市场经理-负责对矿业行业市场的分析及推广、BD工作，竞争对手信息的收集、整理、分析和反馈等，与咨询公司紧密合作；重点项目的前期策划和跟踪，产品及方案宣讲，对客户进行项目支持及技术引导，维护并推进EU/DI/SI的关系及分销商渠道；熟悉国内外主流SCADA/PLC的系统架构、配置和解决方案，根据客户需求及行业应用进行产品选型、系统设计和方案优化，与客户进行售前沟通。项目涵盖各种类型，比如BT、BOT、EPC、EMC（合同能源管理），参与收购利德华福项目（合同额6.5亿美元）。---;通用电气（中国）有限公司,2013.03 , 2015.03,大客户部销售经理,-带领大客户销售团队（7人）负责全国范围内重点大项目大客户，市场推广分析，渠道管理（70家代理商和开发的潜在渠道），关系维护，开发合作伙伴，提供整体解决方案。（团队每年销售指标15M美元）重点关注石油、能源、化工、汽车、钢铁及数据中心等大型行业和项目。（开发了中海油和一汽大众客户）-工作业绩：开发中海油集团，做成GE中海油第一单。国有央企客户为主，中海油，一汽大众，供电局，国电、华电、中电投、联想、国富瑞、鹏博士等---;百度在线网络技术北京有限公司,2015.10 , 至今,高级渠道经理,-负责大搜业务代理商的运营及管理，规范代理商的行为，宣导运营策略，使其符合规章制度，优化代理商组织架构及产业结构，使其更健康地运营，给代理商下任务，新产品落地，出席巡讲发言，组建团队并制定战略方案，分析数据及整合资源，帮助并确保运营单位完成任务，使其业务更健康。-负责百度华北地区最大的代理商盘古网络，调整组织架构，优化考核机制及消费结构，使其完成季度任务且有一定的超额，获得年度大奖。--;},{南京航空航天大学,本科 , 电气工程与自动化,2007年毕业;北京大学,硕士 , MBA,2018年毕业（预计）;},{},{自学,专家;沟通,专家;咖啡,掌握;数据分析,专家;汽车,专家;},{}
cd7138255164ad40d236de52ce2fa4ad, 有物联网，云计算，大数据工作经验；积极乐观，勇于开拓新业务 -                                    ,男,,硕士, 百度-                                -                                                                                                            ,-                                    商务经理 ,3年工作经验,北京,-熟悉硬件产业链，有云计算+通讯行业经验--,解决方案架构师,全职,上海,25k,50k,,,,{ 工作经历 :中国电信股份有限公司物联网分公司,2013.03 , 2016.03,研发&商务,-1、研发车载信息服务平台；-2、运营商核心计费产品设计；-3、前后装车联网项目合作。--;百度,2016.03 , 至今,商务经理,-1、GPU高性能计算在倾斜摄影三维建模项目的推广应用；-2、传统IDC业务；-3、智能客服产品，指定为客户提供定制nlp模块方案；-4、智慧楼宇项目；-5、政府众创空间；----;},{南京航空航天大学,本科 , 本科,2010年毕业;南京航空航天大学,硕士 , 测控技术与仪器,2013年毕业;},{},{},{}
c38d6baedb6ed7fd08f802a1cef5182f, 我是一个喜欢看书，写作，旅游，热爱思考的人。 -                                    ,男,24岁,本科,,,3年工作经验,上海,-我是一个性格开朗，爱看书，爱写作，爱旅游的人。-喜欢看那些能够改变自己思维方式，刷新自己认知的书。主要包括心理学，哲学，文学，艺术方面。凯文凯利，东野圭吾的书会看的比较多。自己的精神导师是乔布斯，敬佩他追随自己内心的生活方式，也钦佩他洞悉人性的能力以及强大的商业运转能力。-我做过两年的程序员，其中开发中夹杂着产品的设计。喜欢研究各种类型的app，喜欢探寻产品背后的意义和吸引用户的本质，崇尚极简主义。-我一直认为能真正做好自己工作的根本原因是因为热爱。因为只有热爱，做事才有动力，才能够更好的提升自我，从而给公司带来更多的价值。-不得不说我是一个热爱互联网的人。我喜欢探讨人性，喜欢发掘用户需求，喜欢一切优雅的东西，喜欢市场，也喜欢商业。-说下我做过的一些产品，曾经做过社交app，公司内部业绩评比app，外企员工erp网站以及现在正在做的东方航空统一身份认证系统。-最后我觉得我最大的竞争力在于自信，热爱生活，对生活始终充满好奇心，发现生活一切美好的事物。-附上个人博客：yohuhu.com--,Python开发,全职,上海,10k,15k,-------,,,{ 工作经历 :南京诚迈科技有限公司,2014.07 , 2016.05,Python开发工程师,-负责产品的相关模块，完成设计和开发。涉及到第三方app以及网站的设计和开发。--;南京千度,2016.06 , 2017.06,Python后台开发运维,-负责东方航空的内部人员统一身份认证系统开发运维，工作涉及到东航员工认证登陆逻辑的开发，包括前台后台的产品的设计和开发。对接大多数东航的ERP系统，集成到统一身份认证的入口进行登陆。--;},{南京航空航天大学,本科 , 计算机科学与技术,2015年毕业;},{},{Python，Django,掌握;Android，Java,掌握;PRD需求文档,掌握;Axure,掌握;html，css，ajax，js,掌握;},{}
d08b0a910b4d5f515f0a329847e5d3c0, 海外运营及国内平台运营经验 -                                    ,男,30岁,本科, tcl移动通信有限公司-                            -                                                                            ,-                                高级运营经理 ,7年工作经验,深圳,-Ø 主导千万级月活用户的产品运营工作，具备运营规划能力；用户、产品运营及变现环节均有经验；具备项目推进经验；-Ø 结果导向，通过用户行为数据和需求提升产品和运营能力。通过产品和运营策略的规划，使主要产品项目月活用户提升500%（至接近千万级）；整体分发提升500%；-Ø 具备产品从0到1的经验，对于用户获取、提升用户留存和用户变现均有经验；通过活跃和营收手段的提升，使整个产品收入提升超过50%，其中海外商店超过200%；-Ø KPI导向，具备成本意识，在运营过程中通过各种变现手段提升产品的营收能力，能够从大局去推进整体的产品、运营和营收能力。-Ø 海外国内市场均有涉猎，对于各类互联网产品模式有了解。独立主导新内容产品前期调研，规划，立项，项目管理跟进，上线级后期维护-Ø 英语精通--,运营,全职,深圳,15k,25k,,,,{ 工作经历 :南京新助成英语培训中心,2008.06 , 2010.01,英语教师,;广州BridgeNova娱乐,2010.06 , 2011.11,游戏运营专员,-负责网页游戏的运营（欧美市场）主要工作内容包括：1负责游戏翻译校对2参与游戏整个运营，主要负责包括国外广告商洽谈，游戏宣传（主要为社交媒体Facebook,Twitter运行），游戏维护，以及游戏周边文学小说网站的运营等等--;万兴信息科技股份有限公司,2011.12 , 2014.06,海外网站编辑,-负责公司网站内容建设，包括营销计划，内容计划，网站建设等等，并为网站和软件带来销售-1.    内容工作：主要工作职责为对万兴旗下相关软件进行营销策划并且撰写英文文章及适当进行推广工作。对页面留存及收入负责-2.    营销计划：利用SNS（Facebook,Twitter,Pinterest等等）平台对原创内容进行推广。活动策划，策划并执行不同的网站活动以吸引用户。---;vivo移动通信有限公司,2014.07 , 2015.01,手游平台运营,-负责vivo手机游戏中心（游戏中心为vivo手机的内置游戏分发平台）的整体运营工作，包括负责模块的全部内容运营工作，用户活动运营策划，游戏中心管理及内容运营；对整个游戏中心的分发和活跃度负责。-主要工作为免费手机游戏内容的提供、专题活动策划、游戏搜索页面优化和分析游戏中心整体平台运营情况。---;万科物业,2017.05 , 2017.07,运营经理,-负责物业信息化产品的运营及规划，包括员工调配系统、内部员工聊天工具及一线员工财富值系统等等---;tcl移动通信有限公司,2015.03 , 至今,高级运营经理,-1.    负责运营团队多个项目的的运营管理工作-A.   对的KPI(活跃，分发以及收入)负责，并且通过各种策略达成KPI-B.   负责应用商店、相机、视频等等产品的运营工作。包括整体的用户获取，运营策略制定（用户+内容+活动），产品质量提升以及变现方式摸索等等-C.   负责规划整体运营策略，对整个运营团队的工作进行规划和梳理，明确各项工作职责-D.   负责各种跨部门的产品运营合作推进，用户获取等等方面的推进和沟通工作-2.    负责阿尔卡特手机应用及游戏分发平台（国内及海外）的业务规划及运营规划工作，包括：-A.   负责国内和海外应用商店和游戏中心的运营规划工作，包括产品功能，数据体系和变现能力提升，内容、活动运营规划，推荐机制策略的规划，以及以数据为主导的本土化内容运营工作等等；-B.   负责商店产品的以数据为核心的运营及产品优化工作，进行内容及用户活动运营，同时通过差异化、精细化运营手段，提升产品的留存和活跃-C.   负责变现模式探索级实现，通过商业模式拓展，产品外延延伸等等手段，使海外应用商店收入提升200%-3.    负责线上产品相机及视频下载的流量获取和用户活动运营-A.  主要负责线上产品的用户获取策略规划及各类用户属性分析，主导产品前期的活动运营策划。并通过数据分析推进产品优化。使产品次日留存提升20%-B.   实现了相机产品一个月内从0下载到日均过万下载--荣获殊荣：2015年度年度优秀员工---;},{南京航空航天大学,本科 , 英语,2008年毕业;},{iskysoft网站内容BigContent方向改版,用户需求分析整理，策划不同内容主题撰写并上线内容,2013.09 , 2014.02,-责任描述：主要项目工作内容为用户需求分析整理，策划不同内容主题，规划内容框架，撰写并保证BigContent的内容上线。项目效果：策划并新建的主题内容为网站带来不错的流量。主题内容为专业的Mac技术技巧类文章（英文）。同时也是部门内完成效果最好的成员之一。项目简介：1网站内容整个改版，由纯SEO内容导向转变为为用户提供解决方案主导。对内容的要求转变为原创，更专业，更用户导向。2通过网站整体内容的优化改版，提升网站内容质量，以增加用户粘性，同时提升网站流量进而带来销售--;应用商店变现,变现手段实现推进,2015.05 , 2016.12,-项目描述：KPI除了活跃用户数及分发量以外，收入也是重要部分，在职期间通过多种手段极大的提升了应用商店的收入水平，主要变现探索包括换量，广告合作，分成洽谈以及自有流量变现等等-成果：积累了产品商业化的经验，并且使海外商店收入提升超过200%---;AppCenter数据结构的优化及需求推进工作,优化商店的数据结构并推进数据结构优化的落地,2015.03 , 至今,-通过从用户行为，页面分析，模块分析，功能等方面对数据体系进行了梳理-成果：产品侧及用户侧各类数据都得到了完善 ---;Alcatel应用商店产品运营,推进产品和运营策略的完善,2015.03 , 至今,-项目描述：    主要通过对商店的运营积累，提炼出未来产品升级的方向，并且推进产品在升级版本中对其进行实现。-通过对产品各模块的优化，本土化运营的优化和拉活手段的优化，使商店的日活人均下载提升超过250%，同时月度活跃用户提升超过500%---;},{},{}
94324f22c524c66d52ebf3c943348a6e, 热爱钻研Android,独立开发 -                                    ,男,24岁,本科, 南京云创大数据科技股份有限公司-                            -                                                                            ,-                                Android开发工程师 ,3年工作经验,南京,-本人一直负责移动端整体开发与维护（androidios），拥有管理移动端工作经验，善于对接客户需求，善于设计现有产品（同声译app连续两年在南京软博会展示），并多次参与公司招标等相关工作---,安卓开发工程师,全职,南京,10k,15k,----本人在现公司担任项目经理，有团队经验---,,,{ 工作经历 :南京西奈科技,2014.07 , 2015.05,Android开发工程师,-负责开发鲜益达，上镜，寻师的外包项目（独立开发和维护）--;南京云创大数据科技股份有限公司,2015.08 , 至今,Android开发工程师,-负责开发和维护同声译，科技头条，wes的安卓客户端，（均独立开发），同声译，环境猫，科技头条均可在应用市场下载。--;},{安徽商贸,大专 , 计算机,2014年毕业;南京航空航天大学,本科 , 计算机技术,2018年毕业（预计）;},{上镜,Android端开发,2014.06 , 2014.10,-整体开发，处理视图，UI，适配，网络请求和用户交互逻辑--;鲜益达,Android开发,2014.10 , 2015.03,-整体开发--;同声译,Android,2015.05 , 至今,-同声译是目前国内唯一一款多语言翻译，识别，朗诵的软件，其中包括了集成第三方支付，用户管理，消息推送，语言识别，语音合成，语音翻译等功能，目前同声译以经历了五次大版本更新（全程参与设计）拥有了上百万用户。以下是本人在同声译开发中担任的工作：1，项目需求分析2，项目人员分配3，项目进度把控4，项目整体设计5，产品改版设计6，上百万用户--;科技头条,Android开发,2015.06 , 至今,-科技头条是一款展示科技新闻的app，其中包括了用户管理，并提供了用户交互功能，用户可以评论，转发，并且为用户提供了广告功能，科技头条已经经历了三次大改以下是本人在科技头条开发中的工作：1，项目需求分析2，项目人员分配3，项目进度把控4，项目整体设计-项目业绩-1，提升公司知名度2，公司通过科技头条与公安厅达成舆情战略合作---;wes,项目经理,2015.10 , 至今,-项目内容-wes是云创的工作管理系统，里面提供了个人工作效率展示，个人工作项目进度查询，工作状态提交，全公司效率展示，同事通讯录展示等功能本人在wes开发中担任了以下工作：1，负责项目整体开发2，负责人员调度与联调3，负责项目进度跟进4，负责对外沟通-项目业绩-wes为公司带来了创收，目前已有16家使用wes，并付费---;环境猫,整体开发,2016.07 , 至今,-环境猫是一款与硬件交互的app，其中包括了与硬件通信，长连接，消息推送，用户管理，展示实时数据，数据图表化等功能。以下是本人对环境猫开发的工作：1，项目需求分析2，项目人员分配3，项目进度把控4，项目整体设计-项目业绩-环境猫是一款家用污染物监控的盒子，app提供远程操控。1，环境猫为公司提供了上百万的销售利润2，环境猫为公司提供了与与国家地震局合作的机会（公司为此设立了地震事业部）3，环境猫在南京软博会展示，提升公司知名度---;新疆人脸识别,Android开发负责人,2016.10 , 至今,-人脸扫描，定位确认（超过使用范围无法使用），人脸比对，人脸一比一比对，开发框架搭建，开发网络请求，post请求，自定义camera，整体UI-项目业绩-为公司对新疆招标提供帮助，并获得合作公司的称赞---;},{xml视图,精通;java,精通;},{}
56cfb792459fe24b6482b06b868db6cf, 无破不立，无痛不快！！！ -                                    ,男,29岁,硕士, 华为技术有限公司-                            -                                                                            ,-                                java 开发 ,3年工作经验,南京,-不喜欢过一眼看到头的生活，希望让自己的激情释放在互联网创业型公司，青春是一张白纸，需要故事来渲染。--,java研发工程师,全职,杭州,10k,15k,,,,{ 工作经历 :Oracle,2012.11 , 2013.05,研发工程师,;华为技术有限公司,2014.02 , 至今,java 开发,;},{南京航空航天大学,硕士 , 计算机应用技术,2013年毕业;},{美国Verizon公司视频点播系统,研发工程师,2012.11 , 2013.05,-为Verizon公司升级视频点播系统，前端是juniper公司提供的类似机顶盒的设备，我们负责服务器端的研发，采用diameter协议实现用户验证、计费、分配带宽、查询视频内容等。我在项目前期负责利用Exsi进行环境搭配，构建30余台虚拟机安装好系统并设置好网络；项目中期负责部分代码的重写；项目后期负责系统的功能测试、寻找bug并修改。--;自动化测试工具,研发工程师,2014.04 , 2014.09,-该系统是为了给开发人员提供从“本地构建”到“用例测试”服务，为测试人员提供“工厂测试”服务，为研发过程降低开发人员的测试门槛，加快研发速度。项目采用web模式为研发人员以及测试人员提供自动化测试工具。我负责了“我要Story(一个功能模块)测试”功能以及“工厂测试”的部分功能。通过这个项目掌握了多线程编程来提高执行效率。--;},{mysql,掌握;netty，mybatis，spring,掌握;memcached、redis,熟悉;Linux,掌握;java多线程编程,精通;},{}
