d0d14cc371d34b4ac4ab88199efb15e9, 仓储物流运营、项目经理、项目管理 -                                    ,女,29岁,本科,,,5年工作经验,深圳,-逻辑性、执行力、统筹能力强--,项目经理,全职,深圳,15k,25k,----已获得PMP证书---,,,{ 工作经历 :富士康科技集团,2012.07 , 2015.08,项目管理,-工作描述：从事电商及制造仓储/物流项目管理工作，含项目启动到项目收尾五个过程组-项目规划方面--进行项目调研及可行性分析，规划项目商务及运作模式，进行项目运作筹备，从人、机、料、法、环各模块方案保障项目成功上线运作；-项目实施方面--执行、管理、监控项目实施，确保项目目标的实现；-项目优化管理--管控项目成本、优化运作流程、提升项目实际运营效果-主要负责&参与项目为：-1.参与宁波跨境电商项目，该项目主要内容为:项目调研及可行性论证，项目立项，项目模式规划(运作模式，商业模式，运作流程),项目落地实施规划(人力，场地，设备，系统等各部分),预计利润为200万/年。-2.主导杭州跨境电商项目，该项目主要内容为:项目调研及项目可行性论证，项目立项，项目规划(模式，运作流程，政府补贴等),项目落地实施规划(人/机/料/法/环),运作改善等。-3.主导郑州跨境电商运作优化，主要内容为:运作流程重整，运作资源优化规划-4.参与跨法人仓储资源整合优化项目两个（iPad+富可视平板),每月营收合计约300万RMB,该类项目主要涉及双方商务合作谈判、仓储/物流解决方案制作、项目正式启动后的项目实施工作，即，运作流程及人力、场地、设备、系统等各环节的统筹规划及执行。-5.参与富士康E商贸项目，该项目主要通过自有&外部电商平台为集团的3C产品提供电子商贸服务，主要参与了3C产品仓储&配送方案制作、电商仓库运作作业规范制定流程优化及流程优化并监控方案的有效实施。-6.负责华为直发物料仓储/物流解决方案制作，为缓释HW松山湖中心仓仓储/物流压力，在富士康EMS厂区建立物料分仓。通过对华为中心仓及富士康代工单位调研，分析、规划制作华为分仓仓储/物流解决方案。-7.负责天津新仓储场地启用规划，建筑面积约10000平米，规划场地启用所需筹备的各类资源（人力&场地使用&设备&动力）、二次工程等、统筹场地启用成本预算制作并监控项目实际执行效果。-8.负责富士康深圳全园区栈板回收方案制作，规划使用可回收的木质栈板替代港仓纸栈板，以减少深圳园区每月40万的纸栈板费用投入，该方案主要涉及与港仓的关务、物流方案规划，以及与富士康代工厂商的物流回收方案和报价规划。-9.负责思科仓储运作优化--PDA导入及优化，主要通过在现有仓储管理流程基础上分析改善环节，制定并论证改善措施，并通过制定标准化作业规范，改善优化现场管理、提升PDA利用率、确保仓储KPI指标的达成。-10.负责富士康代工厂客户线边仓设立，为满足客户多种类、少量、多频次物料发料需求，就近产线设置仓库，通过规划仓库建置方案制定客户报价，并主导进行流程梳理、人力配置、场地规划、系统对接等项目执行事项，确保仓库的顺利建置及现场运作无异常。--;顺丰速运,2015.08 , 至今,项目经理,-1.魅族项目运作：协助魅族B2C项目上线运作，协调客户需求，满足客户日常需求；制作魅族双十一运维方案，从人、机、料、法、环各环节规划保障客户双十一运作正常，减少异常事项的发生；协助进行仓库流程梳理、异常整改，提高项目运作质量；项目收尾阶段进行交接方案制作，确保项目平稳过渡。-2.重点仓储客户项目导入协助：针对顺丰重点仓储项目导入应用项目管理方式进行运作，主要内容如下：客户需求调研、客户仓储方案制作及仓储成本测算、跟进客户合同签署进度、项目上线筹备、项目运作监控及项目收尾。-3.华为电商项目运维---华为电商B2C项目运维工作，主要工作内容为：客户日常特殊需求满足；仓储日常生产运营维护；系统异常及优化跟进；项目运营整体质量及KPI提升；双十一等大促活动的运维；新技术/新设备的推广应用。--;},{大连海事大学（211院校）,本科 , 物流管理,2012年毕业;},{},{英语六级,掌握;PMP证书及项目管理技能,掌握;},{}
0d3b331f273eb08986d73650136b7c62,,男,,本科, 北京市字节跳动网络有限公司-                            -                                                                            ,-                                测试工程师 ,2年工作经验,北京,,,,,,,,,,{:},{},{},{},{}
374969e7ac3e830c5c86aeaa0e53f4bc, 本人从事证券开发工作7年，做过股票，期货以及量化交易 -                                    ,男,30岁,本科, 上海益学企业资讯管理有限公司-                                -                                                                                                            ,-                                    c++项目组长 ,7年工作经验,上海,--本人从事证券行业开发工作六年经验，对股票期货交易有一定了解，熟悉各大券商后台接口，包括顶点，恒生等，熟悉期货CTP接口。熟练掌握VS环境下C++开发，掌握MFC,BOOST,libevent等框架，熟练使用mysql数据库。熟悉多线程及网络编程.---,c++,全职,上海,25k,50k,,,,{ 工作经历 :上海彭博财经资讯有限公司,2010.10 , 2012.10,c++工程师,;上海自然道信息科技有限公司,2012.10 , 2015.02,c++工程师,-量化服务器后端开发，对接上交所数据，对接券商柜台交易系统--;上海益学企业资讯管理有限公司,2015.03 , 至今,c++项目组长,-主持开发行情服务器后台，为前端提供接口，编写量化策略，实时推送到终端，优化服务器性能，熟练使用c++,熟悉boost,tbb,redis,mysql,stl,activemq等--;},{大连海事大学,本科 , 软件工程,2010年毕业;},{博弈大师,客户端开发,2010.10 , 2012.10,-期货模拟交易客户端开发--;自然道量化交易,负责服务器及客户端开发,2012.10 , 2015.02,-量化交易，根据策略自动交易沪深A股股票,负责各大券商后台API接入，以及策略的实现，实现沪深A股的自动下单，负责的基金在一年内实现了60%的收益。--;益学金融平台,项目组长,2015.03 , 至今,-负责益学金融平台客户端开发,主要包括模拟炒股服务器的开发，客户端的开发，以及各种直播，录播视频的展现，后台采用boost.asio网络库，tbb,libevent等，数据库采用mysql.--;},{},{}
ddb84de881c3b982d292c15048279853, 责任心强，效率高，数学专业逻辑思维好，学习能力强，有好学的心 -                                    ,男,25岁,本科, 深圳芯智控股有限公司-                            -                                                                            ,-                                软件工程师 ,2年工作经验,深圳,,,,,,,,,,{:},{},{},{},{}
55842424560460ff5856065d58a7b25e, 对本职工作认真负责，乐于接受新观念，具有较强的团队意识。 -                                    ,女,,本科, 大连海事大学-                                -                                                                                                            ,-                                    软件工程 ,应届毕业生,深圳,,前端开发,全职,深圳,5k,10k,,,,{ 实习经历  :深圳市中外运船务代理有限公司,2015.01 , 2015.03,IT部实习生,;},{大连海事大学,本科 , 软件工程,2016年毕业;},{},{jQuery,了解;SQL Server,了解;J2EE,了解;HTML,了解;CSS,了解;},{}
de894c3ea2244b6579ba780a25da96f7, 丰富的项目经验，良好的编程素养，较强的学习适应能力。 -                                    ,,,硕士, 北京思源互联科技有限公司-                                -                                                                                                            ,-                                    Java研发工程师 ,4年工作经验,北京,,,,,,,,,,{:},{},{},{},{}
a1d4c4b612103785e427fe7ddf4fc7b7, Wu -                                    ,女,,硕士, 百度时代网络技术北京有限公司-                            -                                                                            ,-                                测试工程师 ,3年工作经验,北京,,,,,,,,,,{:},{},{},{},{}
130397b18cc419af4ed5c4b627370c06, 团队管理能力突出，绩效导向的工作思维。 -                                    ,男,38岁,硕士, 红杉信息科技（深圳）有限公司[非红杉资本]-                            -                                                                            ,-                                产品总监或高级产品经理 ,10年以上工作经验,深圳,,,,,,,,,,{:},{},{},{},{}
e8bb88b0d564a12617695975acc54467, 一直专注C++领域的研究，微信号 fightmusic -                                    ,男,38岁,本科, 艾锐势（中国）有限公司-                            -                                                                            ,-                                架构师 ,10年以上工作经验,深圳,,,,,,,,,,{:},{},{},{},{}
80f955ce12af4c48fa3bb5afcca06eef, 做一个有趣的人 -                                    ,男,27岁,硕士,,,2年工作经验,南京,,,,,,,,,,{:},{},{},{},{}
eda22cfd7b60306cdf96576e25e67e3a,,男,,本科,,,9年工作经验,上海,,,,,,,,,,{:},{},{},{},{}
2f07b3a32ae4532a323a9347ef92f63b,,男,,本科,,,10年工作经验,成都,,,,,,,,,,{:},{},{},{},{}
f073855699d5dd356666b8141bbaddb8, 站在团队的角度想事情 -                                    ,,,本科, 北京小米科技有限责任公司-                                -                                                                                                            ,-                                    高级运维工程师或运维主管 ,10年工作经验,北京,,,,,,,,,,{:},{},{},{},{}
b3df80d883046f0b77abd7b3b5ad87ef, 十多年手机柔性板和硬板PCB Layout设计经验 -                                    ,女,42岁,本科, 微软（中国）有限公司-                            -                                                                            ,-                                高级PCB Layout工程师 ,10年以上工作经验,北京,,,,,,,,,,{:},{},{},{},{}
f7e564107f4fd671007f296328710718, 希望和一群有意思的人，一起做有意思的事情。 -                                    ,男,,本科, 华为技术有限公司-                                -                                                                                                            ,-                                    java开发工程师 ,4年工作经验,深圳,,,,,,,,,,{:},{},{},{},{}
c788ff2a6a08ba52ecec98827295b71e, 行动力强，耐心，细心，有责任心！ -                                    ,女,,本科, 上海航运和金融产业基地-                                -                                                                                                            ,-                                    客户服务经理 ,1年工作经验,上海,,活动执行,全职,上海,5k,10k,,,,{ 工作经历 :上海航运和金融产业基地,2016.07 , 至今,客户服务经理,-1.主要负责客户的招商和入驻，做客户服务工作。-2.在公司举办的大型活动中做会务工作，9月份公司主办了上海国际航运周会议为期5天，我负责前期客户的邀请和会议的签到及会见服务工作，5天会议参加人次2000＋，20+演讲嘉宾，10+不同国家-3.负责公司公共空间的各类活动的前期策划、宣传、布置。----;},{大连海事大学,本科 , 国际经济与贸易,2016年毕业;},{},{C1驾照 四六级英语,掌握;},{}
87007356b0114048ab2e68f662704fe4, 一年o2o销售工作经验，长于执行力、细节把控与客户体验。 -                                    ,女,,本科,,,1年工作经验,西安,,,,,,,,,,{:},{},{},{},{}
2b97297878fc7646a202300d000b0172, 一个阳光的东北大男孩的信条:认真的工作，是为快乐的生活负责 -                                    ,男,26岁,本科,,,3年工作经验,大连,,,,,,,,,,{:},{},{},{},{}
4a3bf99ad7ed7a29db647459b3b43e2f, 有主见，注重自身技术与能力的提升，不断学习！ -                                    ,男,,本科,,,应届毕业生,北京,,,,,,,,,,{:},{},{},{},{}
97bcbe04bb1566d5297c80fda53050c3,,男,24岁,本科, 融360-                            -                                                                            ,-                                后端产品组产品经理 ,1年工作经验,北京,,产品经理,全职,北京,10k,15k,,,,{ 工作经历 :美团网,2014.12 , 2015.03,外卖配送事业群产品运营组产品运营助理,--对百度、饿了么和淘点点商家端产品进行订单管理和店铺管理等模块的分析，推测各家产品在商家使用场景上的设想与需求优先级，完成三份竞品分析报告，提出了8个优化点。-为保证产品运行，同时对接两个反馈渠道，实时接收并处理反馈，与产品、研发不断沟通协调保证及时解决问题与收集需求，共处理问题上百个，并给产品经理提需求点10个以上。-为维护平台的正常运营，与各地区BD以及BDM沟通调整商家线上数据，及时解决商家通过平台监管漏洞骗取美团补贴的问题。---;美团网,2015.08 , 2015.12,外卖配送事业群商家组产品经理助理,--完成连锁商家营业状态设置的PRD撰写与评审，跟进开发进度；并撰写测试用例，在测试期间协助QA开展测试；最终项目按时上线，提高了连锁商家对分店的掌控能力与应对突发情况的迅速反应能力。-完成美团专送商家爆单提醒的PRD撰写，在提醒与展示策略上实现单门店商家与连锁商家的兼容，并完成评审。后跟进开发上线，保证了配送爆单机制整体的按时上线实施。-参与连锁商家配送前置的订单状态变更与商家端提醒的方案设计，并完成测试用例的撰写，后期跟进开发并协助完成测试，最终保证项目如期上线。---;融360,2015.12 , 2016.09,后端产品组产品经理,--参与CRM公共客户池高价值客户分配方案的设计，跟进项目开发与上线，并主导后续优化。项目上线至今，高价值客户首次充值转化率共计提升10%。-完成未注册客户转化测试方案的设计，并在上线一周后进行效果评估，转化率比之前的潜在客户高出5倍，从而将未注册客户导入CRM客户池机制化，为销售增加了新的潜在客户来源。-完成CRM潜在客户在任务处理页、通话记录页与数据统计页的展示设计，并跟进开发与上线，使销售管理层可对一线销售人员的潜在客户跟进情况进行实时把控。---;},{大连海事大学,本科 , 行政管理,2016年毕业;},{},{Excel,精通;Mindmanager,精通;Visio,精通;Mockplus,精通;Axure,精通;},{}
a3f54bb5efb1804b0c7224654fac36e0, 清晰地职业规划指引着我前行-执行力强，自我管理 -                                    ,男,26岁,本科, 奇虎360科技有限公司-                            -                                                                            ,-                                测试工程师 ,3年工作经验,北京,,,,,,,,,,{:},{},{},{},{}
ea0e2db1b8a807fa22ec257cbf82cc35, 很快能融入团队，并很快熟悉系统，参与项目的研发 -                                    ,男,31岁,本科, 深圳前海联动云汽车租赁有限公司-                            -                                                                            ,-                                java高级工程师或架构 ,7年工作经验,深圳,,,,,,,,,,{:},{},{},{},{}
c4dac119fea878e93986a9868e99384b, 一个积极向上可靠的人 -                                    ,男,25岁,本科, 软通动力技术服务上海有限公司-                            -                                                                            ,-                                安卓开发工程师 ,2年工作经验,上海,-本人性格友善，善于沟通，擅长于发现问题根源和解决问题，并且乐于学习新知识，喜欢独特的思考方式和完美的解决方案，有少许的完美主义。--,安卓开发工程师,全职,上海,10k,15k,,,,{ 工作经历 :上海我享网络信息科技股份有限公司,2015.07 , 2016.12,安卓开发工程师,-1 负责项目整体框架的搭建、完善和成型；-2 负责整体项目框架的构建，任务分配和计划定制；-3 配合项目经理完成相关任务目标 ；-4 根据研发规范和项目流程编写相关的技术文档。--;软通动力技术服务上海有限公司,2016.12 , 至今,安卓开发工程师,-1. 组织晨会，汇报合作方进度，跟踪项目遗留问题。-2. 合理配置资源，提前预估风险项，把握项目进度。-3. 与华为技术负责人共商项目架构，估算项目代码行数及需求人力，控制成本。-4. 编写java层核心类代码，攻关技术难点，定期组织代码review。-5. 双周四组织开展部门培训计划，制定长期组内员工提高计划，项目交付后开展AAR总结会。--;},{大连海事大学,本科 , 船机修造,2015年毕业;},{来客保,负责代码维护和版本迭代更新；,2015.11 , 2016.03,-来客保是我享度假开发，针对旅游地产楼盘销售业务员的销售工具，能通过移动端接收到我享聚寓购经纪人推送过来的意向客户以及联系方式，并能在后续录入跟单、销售等历史记录，并能通过来客保赚取佣金。--;聚寓购,独立完成整体代码的编写和项目维护；,2016.03 , 2016.09,-聚寓购是中国开放性房产交易平台，定位“做房产O2O行业的‘天猫’”，整合了线上客源、线下渠道以及金融资源，在业内率先完成了真正意义上房产交易O2O闭环。--;我享度假,封装基类和工具类实现代码的复用；,2015.07 , 2016.11,-Weshare我享度假是首个会员制度假权益交换平台。引入度假权益交换这一全新共享经济模式，以度假居住权益为核心，涵盖居住、休闲、养生、玩乐等旅游度假全产业链需求，将闲置的旅游度假权益通过交换分享的形式充分盘活，彻底激活产业链中巨大的沉默价值。--;华为录音转文本2.0,项目PL,2016.12 , 至今,-在华为系统EMUI6.0，Android O版本上的系统应用录音机，该应用功能仅限于底层支持3mic功能的手机，例如mate9，mate10。项目提供录音转文本及语音转文本等功能，相比之前提供了声源定位和远场语音识别等优化，识别率在安静环境下高达90%以上。--;},{},{}
1378360376dcaac5f965d548152c94e6, android开发负责人；学习和解决问题能力强 -                                    ,男,30岁,硕士, 用友金融信息技术股份有限公司-                            -                                                                            ,-                                android 负责人 ,4年工作经验,北京,,,,,,,,,,{:},{},{},{},{}
bb808c7c2f0bc37582ad5362d72185ab, 有一年cocos2dx和unity及半年游戏服务端开发经验 -                                    ,男,24岁,本科, 腾讯无线大连研发中心-                            -                                                                            ,-                                游戏开发工程师 ,1年工作经验,大连,,,,,,,,,,{:},{},{},{},{}
7c7e62992a7b8e6e01f92c9ca836f147, 前支付宝、新浪、暴风员工，人脉广。能写会聊细节控 -                                    ,女,24岁,本科, 北京暴风微城科技有限公司-                                -                                                                                                            ,-                                    市场专员 ,1年工作经验,北京,,,,,,,,,,{:},{},{},{},{}
8c54164b68f8a779997ea0a010425fc9, 2年Java开发经验，学习能力强 -                                    ,男,,本科, 广州飞天网络科技有限公司-                                -                                                                                                            ,-                                    java开发工程师 ,2年工作经验,北京,,,,,,,,,,{:},{},{},{},{}
5003f7dcc9d7c44f928ed4173301c6fa, 一个有活力的年轻人 -                                    ,男,,本科,,,应届毕业生,大连,,,,,,,,,,{:},{},{},{},{}
7e8cc73517cfdcc7a3bf76de3d9c7b57, 现在在百度做前端开发 -                                    ,男,26岁,本科, 百度-                            -                                                                            ,-                                前端开发 ,2年工作经验,北京,,,,,,,,,,{:},{},{},{},{}
62ed282b18770289099f20b2be106caf, 两年文案整理、撰写与微信运营经验，参与多起市场推广项目。 -                                    ,男,28岁,本科, 钛媒体-                            -                                                                            ,-                                新媒体 ,2年工作经验,北京,,,,,,,,,,{:},{},{},{},{}
2b300b9cc1a6621fb7428df4f71ecb13, 测试经验丰富，负责过大型游戏项目的质量控制，责任心强 -                                    ,,,本科, 深圳市迅龙创威网络技术有限公司-                                -                                                                                                            ,-                                    测试主管 ,6年工作经验,深圳,,,,,,,,,,{:},{},{},{},{}
a447a832bbf58adcf829840a6f3a6f34, 。。。 -                                    ,男,24岁,本科,,,应届毕业生,北京,,IT,全职,北京,10k,15k,,,,{ 实习经历  :北京力鼎创软科技有限公司大连研发中心,2016.08 , 2016.10,软件开发,-软件开发--;},{大连海事大学,本科 , 自动化,2017年毕业;},{},{Linux平台shell脚本,掌握;java,掌握;c/c++,掌握;},{}
