400058aed11729d5c89408aea47430fa, 3年软件开发，3年项目管理，熟悉敏捷项目管理，持有PMP！ -                                    ,男,33岁,硕士, 深圳刷宝科技有限公司-                            -                                                                            ,-                                高级项目经理 ,6年工作经验,深圳,-在多年的工作中，积累了多方面的系统开发知识，同时培养优秀的组织架构能力、周密的方案策划能力、良好的沟通协调能力和较强的困难承受能力。个人职业规划希望在项目管理的道路上能够有所成就，最终成为卓有成效的项目管理者！--,项目经理/产品经理,全职,深圳,15k,25k,,项目技能与专业技能,--培训经历--1.世纪卓越项目管理技能培训，时间：3个月，获的PMP证书-2.世纪卓越项敏捷项目管理实战，时间：3个月-3.世纪卓越Project项目管理实战，时间：2天，学习了Project工具在项目管理中的应用-4.德彩光电，IPD外部培训，时间：1周，了解了新产品开发流程--项目技能：--1.熟悉PMP项目管理基本知识，了解项目管理十大领域和五大过程组相关知识；-2.熟悉敏捷项目管理体系，对XP和Scrum敏捷开发过程有深入的研究；-3.了解CMMI体系框架，熟悉软件开发过程的输入、输出与过程活动；-4.会使用Project、Jira、MindManager、Visio等软件制作项目进度计划图、管理项目和工作结构分解等；-5.会使用Flash、Photoshop等软件制作动画、图片，便于说明复杂的问题；-6.具有较强的文字功底，完善的项目过程文档编制技术；--专业技能：--1.了解互联网产品APP客户端和平台的开发基本流程，熟悉产品交付的迭代机制；-2.熟悉Java开发语言，了解进程间通讯机制、窗口启动流程、绘图机制等；-3.熟悉Linux系统下的C/C++程序开发，了解操作系统基本原理和内核基本知识；-4.熟悉ARM体系架构与内核配置机制以及设备驱动程序开发原理，开发和调试过多种设备驱动程序；--,{ 工作经历 :深圳市德彩光电有限公司,2011.11 , 2013.07,项目经理/系统开发主管,-在深圳市德彩光电有限公司任项目经理，兼任系统开发主管，负责整个项目的规划、管理和参与部分研发工作。带领系统开发团队，成功设计了LED交通屏异步控制系统。--;中兴通讯股份有限公司,2013.08 , 2016.09,项目管理,-在中兴通讯云计算及IT研究院任会议视频终端任系统软件开发工程师，全面负责会议视频终端产品软件开发与维护工作，对产品的质量和性能进行负责，多次完成产品新功能的预研、开发、故障处理以及系统版本的制作与发布。后续转向APP客户端项目开发的管理工作，同时在业余时间致力于敏捷项目管理方法的研究，在参与项目实施中多次提出促进项目发展的敏捷实践建议；--;深圳刷宝科技有限公司,2016.11 , 2017.06,高级项目经理,-职位简介：在深圳刷宝科技有限公司任高级项目经理，负责公司重大项目的管理与组织敏捷的转型。在职期完成了公司大名单项目与系统重构项目两个大项目，对项目进度和风险负责。同时对组织项目管理水平的提升和敏捷化负责，进行项目管理能力建设，开展敏捷实战方法的宣讲与指导。降低了风险的发生，使得产品研发更加敏捷化，推动了组织项目管理的变革。---;},{潍坊学院,本科 , 自动化,2009年毕业;大连海事大学,硕士 , 控制理论与控制工程,2011年毕业;},{LED交通屏异步控制系统设计,项目经理,2012.05 , 2013.04,-项目描述：该项目属于研发新项目，用于高速公路上全彩交通屏显示的整体控制。本人当任项目经理，全面负责整个项目的运作，从立项到产品结案以及小批量试产全过程进行项目管理，对成本、进度、范围、质量进行控制。-项目职责：具体工作职责如下：-1、负责市场调研、产品定义、需求方案制定、产品方案制定；-2、负责整个项目方案与子项目方案的规划与详细设计，撰写项目流程所需的各种文档资料；-3、负责项目跟进、项目状态数据收集与向领导层汇报；-4、负责项目各阶段的评审组织、变更处理、协调统一；-5、负责对整个项目成本的把控、进度的推进以及风险的控制；-6、负责管理系统开发组所有成员的全部日常工作与绩效评定，协调其他部门以及项目相关资源配合工作；-7、技术开发与验证-(1)负责系统开发整体架构的规划与设计；-(2)负责系统开发关键技术的解决与突破；-(3)负责部分开发工作，包括硬件设计、驱动开发与内核定制、软件架构与开发、通讯协议的制定等工作；-(4)负责系统开发各关键阶段成果的验证与变更控制；-8、对外关系-(1)系统开发人员招聘；(2)采购供应链跟进；(3)软件外包跟进与验收；(4)业务培训；(5)客户导向与引介；-项目业绩：带领系统开发团队成功开发了LED显示屏控制系统，获得了领导和客户的满意，提高了产品在市场上的竞争力，为公司节约了巨大的采购成本。--;会议视频终端ET701系统开发,系统软件开发,2014.03 , 2014.10,-项目描述：该产品是会议视频终端T700的升级版本；-项目职责：模块任务的开发：-1、开机动态logo显示的实现；-2、IPV4/IPV6/MAC网络地址冲突检测的实现；-3、硬件版本号升级的实现；-项目业绩：实现了开机启动logo图片的动态显示；实现了IPV4/IPV6/MAC地址的冲突上报；添加了硬件版本的读取并层层上传给应用功能；--;语音呼叫端A400系统开发,系统软件开发,2014.10 , 2014.12,-项目描述：会议视频拾音系统，用于远程会议时系统采取现场音频。-项目职责：模块任务的开发：-1、负责调试SD卡读写功能的调试；-2、负责编写按键扫描驱动程序；-项目业绩：成功配置了内核，调试通了SD卡功能；编写的按键扫描驱动可以及时而精确地扫描到按键值。--;会议视频终端T700系统开发,系统软件开发,2013.09 , 2015.07,-项目描述：中兴通讯会议视频主打产品，用于政府和企业进行远程会议的终端。-项目职责：-1、产品预研：负责产品新需求的预研工作，对系统方案的可行性进行实践验证；-2、方案设计：根据技术经验和预研成果制定技术方案，发起评审，供领导层决策；-3、功能开发：负责产品新功能开发、任务的展开与阶段性实现，对产品范围进行控制；-4、系统任务：负责系统底层内核与驱动的开发和调试工作，为产品建立稳定的系统环境；-5、版本发布：负责产品底层BSP系统版本制作与发布，对产品系统的稳定性把关；-6、团队协作：负责与项目组其他成员协同工作，指导与解决研发问题，共同突破难关；-7、故障协调：负责协调研发部、测试部、硬件部、中试部、产线和现场等部门，处理与跟踪遇到的系统故障，对产品的质量把关；-项目业绩：全面负责会议视频系统底层内核与驱动的研发与维护，开发了多种新功能与解决了多种异常故障；--;会议视频系统安卓单窗口显示预研,新领域预研,2015.01 , 2015.07,-项目描述：会议视频系统的新产品上有望在将来进行多窗口的显示，该任务负责研究单窗口的显示机制；-项目职责：-1、阅读安卓源码，了解安卓系统下单窗口的启动的流程；-2、查询网络资料，了解安卓系统下进程间通讯机制、窗口启动流程、绘图机制等；-项目业绩：成功梳理了安卓单窗口启动和显示的机制，为会议视频系统产品开辟了新的研究领域；--;中兴MOA项目,项目工程师,2015.08 , 2016.07,-项目描述：该项目用于中兴内部员工的移动办公app，本人任项目工程师，负责项目计划的制定、进度的跟进、项目状态报告、会议组织与纪要、资源优化、过程改进与绩效考核等工作。-项目职责：-1.计划制定：与产品经理和开发团队成员沟通，制定项目发布计划和迭代计划，并跟进与维护；-2.进度跟进：跟踪每个项目成员的任务进展，发现任务延迟点和难点，组织资源解决，避免项目延迟的风险；-3.会议组织：组织项目启动会议、发布会议、迭代会议、性能交付会议、中期状态检查会议、项目总结会议等；-4.资源优化：根据项目任务的完成情况，进行资源协调和优化，以便加快开发进度；-5.过程改进：改进项目流程、引入先进的敏捷管理方法、制定合理的迭代机制；-6.项目考核：根据考核方案，结合各科室考核结果来考核项目组成员的项目绩效；-项目业绩：完成多个版本的如期上线，交付了产品预期的要求；改进项目管理流程，提升了开发的效率；--;大名单项目,项目经理,2016.11 , 2017.02,-项目描述：该项目是公司的面向蓝领以外的社会群体开展的放贷业务项目，是公司的重大发展方向；-项目职责：-1、负责推动业务方需求的及时落地与产品对接；-2、负责迭代计划的制定与维护；-3、负责项目每日例会的开展与日报输出；-4、组织团队各种项目会议；-5、负责协调团队开发问题解决与风险处理；-项目业绩：成功如期交付了该项目3个迭代版本，符合组织的要求；---;花薪APP重构项目,项目经理,2017.03 , 2017.06,-项目描述：该项目是前端APP与后台以及征审系统、管理系统、核心系统、催收系统、贷中监控系统、商户管理系统、商户结算系统等多个系统的重构；-项目职责：-1、重构版本项目计划的制定与跟进；-2、每日例会的开展与团队问题处理；-3、负责调动团队资源开发项目，维持开发稳定的进度和节奏；-4、风控核心系统和催收系统前期研发的跟进，需求协调与进度把控；-5、组织预发布上线与试点发布上线，线上问题跟踪处理；-6、重构期间老版本项目需求的开发跟进与重大问题处理；-项目业绩：成功完成了版本的重构，进度和风险在可控范围内，对后续业务发展起到重大作用；---;},{敏捷项目管理,掌握;},{}
2f08fa08618d30b4abd831d6e139295a, 一个程序猿 -                                    ,男,,硕士,,,应届毕业生,大连,,软件工程师,全职,大连,10k,15k,,,,{ 实习经历  :1,2015.01 , 2016.01,2,-3--;2,2017.01 , 2017.03,3,-4--;},{大连海事大学,本科 , 信息管理与信息系统,2017年毕业;大连理工大学,硕士 , 软件工程,2019年毕业（预计）;},{},{},{}
e32d9bcf39177cd3764b52701f857c69, 测试 -                                    ,男,,硕士, 华宇金信（北京）软件有限公司-                                -                                                                                                            ,-                                    高级产品经理 ,8年工作经验,北京,,副总裁等管理岗位,全职,郑州,25k,50k,,,,{ 工作经历 :华宇金信, , ,高级产品经理,;华宇金信（北京）软件有限公司,2014.03 , 至今,高级产品经理,;},{大连海事大学,硕士 , 工商管理,2019年毕业（预计）;},{},{},{}
30e3ad814da37078a60e297591983226, 伟大不是体现在领导别人，而是体现在管理自己上。 -                                    ,,,硕士, 上海沃行信息技术有限公司-                                -                                                                                                            ,-                                    VP ,10年以上工作经验,上海,,,,上海,,,,,,{ 工作经历 :上海沃行信息技术有限公司,2011.09 , 至今,VP,;},{大连海事大学,本科 , 航海,1999年毕业;复旦大学,硕士 , MBA,2007年毕业;},{},{},{}
d511aedcf000b50c4653df767fd13b4b, 因为热爱所以专注，双赢才是最终目标。 -                                    ,女,27岁,本科, 光明中金文化传媒有限公司-                            -                                                                            ,-                                产品经理 ,3年工作经验,深圳,-1.本人带领过5-7人的团队，善于沟通以及协调各方资源。-2.学习能力强，自我驱动性强，具有良好的抗压性，善于排解各种压力。-3.能够熟练使用原型绘制软件（Axure、pencil等），思维导图、MicrosoftVisio、版本控制工具SVN，office办公软件；能够正确使用项目管理软件MicrosoftProject，版本管理工具SVN、Photoshop等。-4.具有很强的事业心和责任感，能吃苦、不轻言放弃；做人诚实守信,忠诚于单位。-5.有非常强的适应能力,能很快的融入到公司和团队。-   希望我的真诚与专业能换取您的青睐，我一定会用自行动向您证明我不会辜负您的期待，愿有机会能与贵公司共同进步，为公司的发展贡献自己的一份力量。---,产品经理,全职,深圳,15k,25k,,,,{ 工作经历 :中国中建设计集团有限公司,2013.08 , 2014.08,人事处职员,;云点纵横(北京)科技有限公司,2014.09 , 2016.01,产品（项目）经理,--搜集用户需求，整理细化需求-根据需求进行功能设计，并协调研发团队进行技术评审-安排整理研发计划，协调团队工作，按照计划督促协调进度-负责团队内外各方面的协调工作，确保产品保质完成-撰写需求文档等相关文档---;光明中金文化传媒有限公司,2016.06 , 2017.04,产品经理,-职责范围：1.定义产品，分析产品可行性1.搜集用户需求，整理细化需求 2.根据需求进行功能设计，并协调研发团队进行技术评审3.安排整理研发计划，协调团队工作，按照计划督促协调进度4.负责团队内外各方面的协调工作，确保产品保质完成5.撰写需求文档等相关文档--;},{大连海事大学,本科 , 信息管理与信息系统,2013年毕业;},{企业级服务手机APP“咋办”,产品经理,2014.12 , 2015.01,-参与手机APP“咋办”V1.1、V1.2和V1.3需求搜集工作,随后绘制了相关原型图，进行了功能整理，需求确定后，配合研发团队进行功能实现，把握产品研发进度，做好与客户的沟通工作，在产品上线前组织相关人员进行测试，确保产品正常上线，并协助安排解决上线后产品相关的维护问题。--;手机APP“IT圈”,运营,2014.09 , 2015.11,-参与手机APP“IT圈”的运营以及线下推广工作主要负责与线下会议主办方合作事宜的洽谈。--;中国电信App－优e,产品经理（项目经理）,2015.01 , 2016.02,-   优e是与中国电信集团无线网优部门合作开发的一款手机应用，产品一期主要为解决客户大量经典案例无法共享的的需求，相关功能于2015年3月底正式上线第一个版本，后续迭代8个新版本；产品二期主要实现数据在地图上的呈现，并添加工单相关部分，增强与线下工作的耦合，充分发挥移动端设备优势增强办公效率，目前已进入开发阶段。      本人在项目中主要职责：与客户进行需求对接，需求整理细化，产品功能设计，绘制线框图原型图，需求确认，召开技术评审会议，配合研发部制定研发计划，同时负责整个项目过程中内部与外部相关事务的沟通协调。--;翘客,产品经理,2016.06 , 2017.03,-   “翘客”App是一款为在校大学生提供的免流量视频观看软件。大学生可以在校园内连接校园网实现免流量观看视频，也可在其他WiFi以及4G环境下消耗流量使用软件。目前翘客已于芒果TV，爱奇艺，搜狐，乐视，优酷等各大主流视频平台取得合作，用更丰富更优质的内容服务大学生。 -    项目过程中，独立完成“翘客”App（iOS、android）、PC客户端（Mac、windows）的产品相关工作。翘客是一款为大学生提供的免流量视频App，大学生在校园中连接校园网即可享受免流量观看视频的服务，目前产品已与芒果TV，爱奇艺，搜狐，乐视等多家主流视频平台达成合作，推广一个月大学生用户达到3万人。-    --;翘客校园,产品经理,2017.01 , 2017.04,-   “翘客校园”App是为大学生服务的跑步运动App。目前在校大学生的身体素质每况愈下，提高国家青少年的身体素质成为了教育部工作的重心。为相应国家号召，承接大学生跑步运动活动以及各项赛事，落地设计了“翘客校园”App，不仅可以支持大学生平时基本的跑步计步需求，也可为各种跑步活动或赛事提供技术支持，更好的举办比赛。-   项目过程中带领团队完成“翘客校园”App的设计。根据公司的战略需求，完成需求搜集，功能设计等工作，目前产品原型已经合格交付，按计划进入设计阶段。--;},{},{}
b701b6839ca4f916c88c788d37d774d1, 热爱工作，较强的理解动手能力！ -                                    ,男,,本科,,,应届毕业生,成都,,大数据相关工作,全职,成都,5k,10k,,,,{:},{大连海事大学,本科 , 船舶电子电气工程,2017年毕业;},{},{},{}
f8ae65c2ab0f2e7d83184b10baa8d431, 4年工科专业学习；2年互联网产品经理专业培训 -                                    ,男,,本科, 大连海事大学-                                -                                                                                                            ,-                                    船机修造 ,应届毕业生,大连,,test,实习,烟台,5k,10k,,,,{:},{大连海事大学,本科 , 船机修造,年毕业;大连海事大学,本科 , 船机修造,2018年毕业（预计）;},{},{},{}
3b3ff5809556a5e3a28bbfd2e432ae76, 认真、负责、有激情 -                                    ,男,29岁,硕士, 东软集团-                            -                                                                            ,-                                图像算法 ,2年工作经验,大连,,图像处理及识别,全职,北京,10k,15k,,,,{ 工作经历 :东软集团,2015.07 , 至今,图像算法,;},{大连海事大学,硕士 , 电子信息工程,2015年毕业;},{智能辅助驾驶开发,负责人脸检测结果描画和疲劳预警模块,2015.07 , 2016.06,-1、负责人脸检测结果描画和疲劳预警模块构想设计（SD）作成集合测试式样作成（IT设计）；-2、负责人脸检测结果描画和疲劳预警模块详细设计（MD）作成和单体测试式样作成（UT）；-3、负责人脸检测结果描画和疲劳预警模块编码；-4、相关测试--;车内安全驾驶,车内驾驶员行为检测主要负责人,2016.06 , 至今,-1、人脸检测和特征点检测设计和编码-2、眼睛开闭状态检测设计和编码-3、疲劳预警式样设计-4、驾驶员行为检测相关式样文档作成，检测分类器训练和相关调试-5、抽烟和打电话相关设计（正在做）--;},{},{}
16ac278a4902fb1b14782cad048c4922, 创业者。 -                                    ,男,,本科,,,2年工作经验,西安,,市场经理,全职,西安,5k,10k,,,,{ 工作经历 :北京泊远网络科技有限公司, , ,大区经理,;},{大连海事大学,本科 , 交通运输管理,2016年毕业;},{},{},{}
2f2bf14e7ccc49de9c1a1828d6ab2b53, 一直在数据科学的道路上不断学习，不断进步 -                                    ,男,26岁,硕士, 北京科技大学-                             -                                                                            ,-                                物流工程 ,应届毕业生,深圳,-  1.学习热情高昂 --不断在Coursera、edX等MOOC网站上学习名校课程，有明确的学习目标和学习计划，能快速学习新东西。 -能快速学习、适应新东西。有过三天内上手一门软件并制作视频教程的经验。--  2.逻辑分析能力强 --以分析而非艺术的思维获得果壳网MOOC学院“设计家的摇篮——阿克苏诺贝尔奖学金”第一名。--  3. 具有团队意识--以团队整体目标为导向，在完成自己工作的基础上，积极主动帮助同事承担一部分工作。--  4. 执行力强 --做事不拖沓，能完成的事会第一时间完成。 ---,数据分析师,全职,深圳,10k,15k,-----热衷于互联网行业-擅长数据分析理论和技能-有过互联网产品运营经验----,校内成绩,--CET-6.-国家奖学金。-中国远洋集团奖学金。---,{ 实习经历  :果壳网,2015.06 , 2015.08,运营实习生,--内容运营：丰富、优化网站内容，包括物料的筛选、文案写作、专题制作、内容推广等。-用户运营：与用户沟通，并与活跃用户培养感情；分析用户行为交互数据，并根据数据分析的结论对用户分类、对比，为产品优化和运营方向提供了建议；使App在初期增长了2k+的用户量。---;马上金融,2015.11 , 2016.01,数据分析师,--负责数据库（MySQL）的数据提取、数据清洗-负责金融业务标准表系统（HIVE）的开发、测试-负责报表的计算（MySQL、Excel）-负责满足其他部门其他的统计需求（R）---;},{大连海事大学,本科 , 海洋科学,2013年毕业;北京科技大学,硕士 , 物流工程,2016年毕业;},{“神舟八号”飞船实验样本的数据分析,数据分析员,2013.03 , 2013.06,--用Excel处理约312,000样本量的“神舟八号”飞船返回生物实验样本的数据， -使用聚类分析模型，分析各实验组数据的变化规律，对太空环境的影响给出结论。---;某军方研究所三维人体头部模型的编辑,执行人,2014.06 , 2014.08,--用Geomagic、Imageware、Zbrush等逆向造型和三维雕刻软件将三维扫描的人体头部点云源数据处理成美观的、具有人体测量意义的三维模型。-参与人体头部模型3D打印成实体模型。 ---;美国社会普查数据(GSS)的挖掘、处理分析,数据分析员,2014.09 , 2014.12,--通过对约480,000样本的GSS数据挖掘、分组并作方差分析，得出结论， -用Rmarkdown撰写关于美国黑人教育水平与子女数量关系的英文报告。---;动作捕捉数据的挖掘、处理、分析,执行人,2015.01 , 2015.03,--使用动作捕捉设备采集20GB的动作捕捉数据，数据量约64,000个，-使用MATLAB将源数据处理计算，并挖掘成80组，-编写R程序，对80组数据批量处理，作描述性统计分析和显著性检验，得出研究结论。---;},{Google Analytics,了解;MySQL,熟悉;Excel,掌握;SPSS,掌握;R语言,掌握;},{,;,;,;,;,;}
2a343ff981ff905349d410d385ce71ee, 连续三年最佳团队，两年突出贡献奖。 -                                    ,男,29岁,本科, 成都数之联科技有限公司-                            -                                                                            ,-                                售前支持部门经理 ,5年工作经验,成都,-做事沉稳用心。--,大数据方向,全职,成都,15k,25k,,,,{ 工作经历 :南京智精灵教育科技有限公司,2012.07 , 2013.05,营销合伙人,;成都芯软科技发展有限公司,2013.09 , 2014.09,产品经理,;成都数之联科技有限公司,2014.10 , 2015.03,深度学习部门经理,--组建6人的深度学习团队，打造学习型组织文化；-运用深度学习技术开发产品提供图像检索服务；-为国内最大的小商品市场义乌购的app及网站提供图像检索服务，已累计调用百万次。---;成都数之联科技有限公司,2015.03 , 2015.07,大数据产品经理,--定义公司电商服务服务产品，为五粮液、哈尔斯、阿坝等客户提供电商大数据服务，为其生产、营销提供决策支持服务；-定义公司企业数据服务产品，为成都市工商局、浙商银行、中细软等客户提供企业数据服务。---;成都数之联科技有限公司,2015.06 , 2016.03,咨询部门经理,--组建数之联咨询团队；-为自贡提供智慧城市咨询；-为三泰、置信、中融人寿等大型集团公司提供大数据咨询服务；-为郫县、贵阳提供大数据产业规划服务；-为崇州等地提供大数据资源顶层设计服务。---;成都数之联科技有限公司,2016.03 , 至今,售前支持部门经理,--打造数之联售前部门；-为政府、金融、制造、军工等上百家企业提供大数据售前项目支持工作；-大数据项目转化金额近千万。---;},{大连海事大学,本科 , 物流管理,2012年毕业;},{认证云平台,产品经理,2013.09 , 2014.09,-认证云平台主要为社保局提供认证数据导入，材料辅助认证处理，app视频认证，终端流水状况，认证结果展示并下载。便于社保局下载认证结果并发放养老金。--;老友网,产品经理,2013.09 , 2014.09,-老友网1.0是社保认证结果查询的网站。--;社保认证app,产品经理,2013.09 , 2014.09,-社保认证app是一款针对个人的社保认证应用。运用人脸识别技术减少社保机构认证工作量，优化认证流程让老人足不出户就可以完成认证。--;社保认证发布平台,产品经理,2013.09 , 2014.10,-社保认证发布平台主要目的是帮助社保局进行认证前的短信通知和认证结果短信通知。--;},{},{}
